id	conversation_id	created_at	date	time	timezone	user_id	username	name	place	tweet	language	mentions	urls	photos	replies_count	retweets_count	likes_count	hashtags	cashtags	link	retweet	quote_url	video	thumbnail	near	geo	source	user_rt_id	user_rt	retweet_id	reply_to	retweet_date	translate	trans_src	trans_dest
1520436701730123782	1520410085591289859	2022-04-30 09:15:32 PDT	2022-04-30	09:15:32	-0700	1287911543393464320	alyvore	skramz enjoyer		@emptinessthreat i’m not sure i would say feminist anthropologists aren’t foucauldian. sure, many of them are not, and they have an extremely complicated legacy with foucault and “poststructuralism” broadly. but foucault has definitely been very important for feminist anthropology!	en	[]	[]	[]	2	0	2	[]	[]	https://twitter.com/alyvore/status/1520436701730123782	False		0								[{'screen_name': 'emptinessthreat', 'name': 'kathy’s lament', 'id': '1430686097336635402'}]				
1519678180205944834	1519678180205944834	2022-04-28 07:01:27 PDT	2022-04-28	07:01:27	-0700	1192564385253928965	feministjournal	Feminist Anthropology Journal		Before our new pieces come out soon, have you read our November articles?  Read all four of our issues today:  https://t.co/hwd2n5wEpN  #anthrotwitter #AcademicChatter @femanth @AmericanAnthro  https://t.co/BNMuERiJq5	en	[{'screen_name': 'femanth', 'name': 'association for feminist anthropology', 'id': '422375034'}, {'screen_name': 'americananthro', 'name': 'american anthropological association', 'id': '42914038'}]	['https://anthrosource.onlinelibrary.wiley.com/loi/26437961']	['https://pbs.twimg.com/media/FRb674vXIAADK9k.jpg']	0	3	7	['anthrotwitter', 'academicchatter']	[]	https://twitter.com/FeministJournal/status/1519678180205944834	False		1	https://pbs.twimg.com/media/FRb674vXIAADK9k.jpg							[]				
1515772240247336969	1515771184033538049	2022-04-17 12:20:38 PDT	2022-04-17	12:20:38	-0700	1393958541157801992	hormonaljew	pronouns in bio		it’s definitely a bit silly of me to be getting so frustrated with this lmao but if I stop tweeting now then that graduate level seminar on queer feminist anthropology would have been for nothing	en	[]	[]	[]	1	0	20	[]	[]	https://twitter.com/HormonalJew/status/1515772240247336969	False		0								[]				
1515300203577974784	1515300203577974784	2022-04-16 05:04:56 PDT	2022-04-16	05:04:56	-0700	930048198693019648	profdebsen	Debarati Sen		Great prizes and grants for students and scholars doing feminist anthropology. Senior Book Prize deadline is May 1, Dissertation grant due June 1 (for other award &amp; deadlines see below) If you need more info DM @femanth or me  🙏🏾✨🌈☀️	en	[{'screen_name': 'femanth', 'name': 'association for feminist anthropology', 'id': '422375034'}]	[]	[]	0	10	24	[]	[]	https://twitter.com/profdebsen/status/1515300203577974784	False	https://twitter.com/femanth/status/1505447734865969152	0								[]				
1515006325239042056	1515006325239042056	2022-04-15 09:37:10 PDT	2022-04-15	09:37:10	-0700	1121586790597627904	putawaytheglobe	Dr. Katrina Daly Thompson 🏳️‍🌈 ☪️ ✍️📚		"76/#260articles  Ott, Jessica. “Umoja: A Swahili Feminist Ethic for Negotiating Justice in Zanzibar.” Feminist Anthropology 2022 (Early View).  https://t.co/cz4ZRimnQS.  I'm curious why ""vikoba"" is now being spelled ""vicoba,"" when #Swahili doesn't usually have the letter c."	en	[]	['https://doi.org/10.1002/fea2.12080']	[]	0	1	0	['260articles', 'swahili']	[]	https://twitter.com/putawaytheglobe/status/1515006325239042056	False		0								[]				
1514245740335411207	1514245740335411207	2022-04-13 07:14:52 PDT	2022-04-13	07:14:52	-0700	48254999	m_older	Doctora Malka Older		Imagining a world in which there are more and better-paid job opportunities for feminist anthropology than for marketing  because I sure don't have to imagine a world in which we need feminist anthropology more than we need marketing.	en	[]	[]	[]	1	9	55	[]	[]	https://twitter.com/m_older/status/1514245740335411207	False		0								[]				
1513691566388490240	1513691566388490240	2022-04-11 18:32:47 PDT	2022-04-11	18:32:47	-0700	159617905	incognegra_	ally		Just submitted my first peer review for the Feminist Anthropology journal 🥳	en	[]	[]	[]	0	0	12	[]	[]	https://twitter.com/incognegra_/status/1513691566388490240	False		0								[]				
1511008980222590986	1511008980222590986	2022-04-04 08:53:08 PDT	2022-04-04	08:53:08	-0700	3374376179	philb6vis	Phil Bevis		Bury Class Society  Before It Buries Us All:  Eleanor Burke Leacock’s Vision  for a Marxist Feminist Anthropology  01/02/22 | Ahmed Kanna || MR  https://t.co/txabvVwhWy	en	[]	['https://monthlyreview.org/2022/02/01/bury-class-society-before-it-buries-us-all/']	[]	0	1	1	[]	[]	https://twitter.com/PhilB6vis/status/1511008980222590986	False		0								[]				
1508938557540474890	1508938557540474890	2022-03-29 15:46:01 PDT	2022-03-29	15:46:01	-0700	877069593369497600	aus_anth	Australian Anthropological Society		The Association for #feminist #anthropology has a series of awards currently open, including prizes for books, papers and dissertations. More information at:  https://t.co/HB6A6NHwu6	en	[]	['https://buff.ly/3wIgjs8']	[]	0	2	7	['feminist', 'anthropology']	[]	https://twitter.com/aus_anth/status/1508938557540474890	False		0								[]				
1508838119516385284	1508838119516385284	2022-03-29 09:06:55 PDT	2022-03-29	09:06:55	-0700	2792096925	cascatweet	CASCA		Deadline April 2: CASCA Women's Network 2022 Award for Student Paper in Feminist Anthropology Prix étudiant du Réseau des femmes de la CASCA 2022 - date limite le 2 avril  https://t.co/smbNXGizss #cdnanth  @CascaWN_RF	fr	[{'screen_name': 'cascawn_rf', 'name': 'cascawn/rf', 'id': '3818186187'}]	['https://cas-sca.ca/student-zone-notices/32069-casca-women-s-network-2022-award-for-student-paper-in-feminist-anthropology']	[]	0	1	1	['cdnanth']	[]	https://twitter.com/CASCATweet/status/1508838119516385284	False		0								[]				
1508207728229072902	1508207728229072902	2022-03-27 15:21:58 PDT	2022-03-27	15:21:58	-0700	892499768118837248	stellaoyekanmi	Moj💕		I am going to be the first professor of Feminist anthropology in Nigeria.	en	[]	[]	[]	1	0	6	[]	[]	https://twitter.com/StellaOyekanmi/status/1508207728229072902	False		0								[]				
1507416976993435679	1507311596837691415	2022-03-25 10:59:48 PDT	2022-03-25	10:59:48	-0700	799077155732865025	babysis121	cj 🦋		@the_law719 Oh yes it's home girls: a black feminist anthropology	en	[]	[]	[]	1	0	1	[]	[]	https://twitter.com/Babysis121/status/1507416976993435679	False		0								[{'screen_name': 'the_law719', 'name': 'Niece 🦋', 'id': '3295840625'}]				
1506847283526176768	1505988936526712834	2022-03-23 21:16:02 PDT	2022-03-23	21:16:02	-0700	2476991898	anthro919	Weighing the Future by Natali Valdez		@FeministJournal @tessamuldvarp @femanth @AcademicChatter Thank you for supporting my work and sharing it with the great feminist anthropology community!	en	[]	[]	[]	0	0	0	[]	[]	https://twitter.com/anthro919/status/1506847283526176768	False		0								[{'screen_name': 'FeministJournal', 'name': 'Feminist Anthropology Journal', 'id': '1192564385253928965'}, {'screen_name': 'tessamuldvarp', 'name': 'Tessa Moll', 'id': '257543088'}, {'screen_name': 'femanth', 'name': 'Association for Feminist Anthropology', 'id': '422375034'}, {'screen_name': 'AcademicChatter', 'name': 'Academic Chatter', 'id': '885953601067208705'}]				
1506673394963603463	1506673394963603463	2022-03-23 09:45:04 PDT	2022-03-23	09:45:04	-0700	42914038	americananthro	American Anthropological Association		We partnered with the Association for Feminist #Anthropology (@femanth)  to honor the legacies of anthropologists that helped shape our understanding of religion, race, class, violence, and affect.   Learn more about the work of Margaret Trawick. #WomensHistoryMonth  https://t.co/GZCABdCyC9	en	[{'screen_name': 'femanth', 'name': 'association for feminist anthropology', 'id': '422375034'}]	[]	['https://pbs.twimg.com/media/FOjHd7kXoA8NXrg.jpg']	0	3	17	['anthropology', 'womenshistorymonth']	[]	https://twitter.com/AmericanAnthro/status/1506673394963603463	False		1	https://pbs.twimg.com/media/FOjHd7kXoA8NXrg.jpg							[]				
1504178597648646146	1486842979297816577	2022-03-16 12:31:38 PDT	2022-03-16	12:31:38	-0700	888881477504696320	teresamargit	TeresaMargit		"@WestboroPapist @LilithWon_FDS Well, science is not a belief system. Feminist anthropology is actually just methodology. What do you mean by ""the myth of patriarchy being recent"". I did not say that. I'm saying that there used to be more matriarchal societies than there are now."	en	[]	[]	[]	1	0	1	[]	[]	https://twitter.com/TeresaMargit/status/1504178597648646146	False		0								[{'screen_name': 'LilithWon_FDS', 'name': 'Lilith 💋 ⚔ (Female Strategy Podcasts)', 'id': '1402471679163465732'}]				
1504124871973883905	1486842979297816577	2022-03-16 08:58:09 PDT	2022-03-16	08:58:09	-0700	1414258732360298497	sexisillegal	🇨🇭Frenito Mussolini (cow herder)🇻🇦		@TeresaMargit @LilithWon_FDS You unironically believe in feminist anthropology and the myth of patriarchy being recent	en	[]	[]	[]	1	0	0	[]	[]	https://twitter.com/Sexisillegal/status/1504124871973883905	False		0								[{'screen_name': 'TeresaMargit', 'name': 'TeresaMargit', 'id': '888881477504696320'}, {'screen_name': 'LilithWon_FDS', 'name': 'Lilith 💋 ⚔ (Female Strategy Podcasts)', 'id': '1402471679163465732'}]				
1503356086400823299	1503356086400823299	2022-03-14 06:03:16 PDT	2022-03-14	06:03:16	-0700	2792096925	cascatweet	CASCA		Deadline Extension to April 2: CASCA Women's Network 2022 Award for Student Paper in Feminist Anthropology/ Prix étudiant du Réseau des femmes de la CASCA 2022 - nouvelle date limite le 2 avril  https://t.co/smbNXGizss #cdnanth @CascaWN_RF	fr	[{'screen_name': 'cascawn_rf', 'name': 'cascawn/rf', 'id': '3818186187'}]	['https://cas-sca.ca/student-zone-notices/32069-casca-women-s-network-2022-award-for-student-paper-in-feminist-anthropology']	[]	0	0	1	['cdnanth']	[]	https://twitter.com/CASCATweet/status/1503356086400823299	False		0								[]				
1503187693898981376	1503187693898981376	2022-03-13 18:54:08 PDT	2022-03-13	18:54:08	-0700	3818186187	cascawn_rf	CascaWN/RF		Deadline Extension to April 2: CASCA Women's Network 2022 Award for Student Paper in Feminist Anthropology/ Prix étudiant du Réseau des femmes de la CASCA 2022  https://t.co/0MOmHPSi2k…… #cdnanth  @CascaWN_RF	fr	[{'screen_name': 'cascawn_rf', 'name': 'cascawn/rf', 'id': '3818186187'}]	['https://cas-sca.ca/student-zone-notices/30455-casca-women-s-network-2022-award-for-student-paper-in-feminist-anthropology-prix-etudiant-du-reseau-des-femmes-de-la-casca-2022']	[]	0	1	0	['cdnanth']	[]	https://twitter.com/CascaWN_RF/status/1503187693898981376	False		0								[]				
1502723797635547145	1502723797635547145	2022-03-12 11:10:47 PST	2022-03-12	11:10:47	-0700	159617905	incognegra_	ally		"The Feminist Anthropology journal asked me to peer review a manuscript as I've been ""identified as having expertise or experience"" in the field 🥺"	en	[]	[]	[]	6	0	18	[]	[]	https://twitter.com/incognegra_/status/1502723797635547145	False		0								[]				
1502537881633447937	1501900422935719942	2022-03-11 22:52:01 PST	2022-03-11	22:52:01	-0700	1414258732360298497	sexisillegal	🇨🇭Frenito Mussolini (cow herder)🇻🇦		@katynhotel @Mak88V @_La_Griffe_ Wrong. Learn about Paleolithic people and stop believing feminist anthropology. Crop growers are more egalitarian in terms of gender and nomads are more patriarchal but economically equal	en	[]	[]	[]	0	0	0	[]	[]	https://twitter.com/Sexisillegal/status/1502537881633447937	False		0								[{'screen_name': 'katynhotel', 'name': 'Katyn Hotel', 'id': '1261535116377165825'}, {'screen_name': 'Mak88V', 'name': 'Mak', 'id': '1501005973732872200'}, {'screen_name': '_La_Griffe_', 'name': 'La_Griffe', 'id': '1455692609905643520'}]				
1500170693190635521	1500170693190635521	2022-03-05 10:05:39 PST	2022-03-05	10:05:39	-0700	1046862043020648451	kesheldon52	Kathleen Sheldon		@JessMarieOtt Nice to see this article in early view from Feminist Anthropology,  https://t.co/a1hMkvL9V6	en	[]	['https://anthrosource.onlinelibrary.wiley.com/doi/abs/10.1002/fea2.12080?campaign=wolearlyview']	[]	1	2	2	[]	[]	https://twitter.com/kesheldon52/status/1500170693190635521	False		0								[]				
1499787267711422469	1499787266042089472	2022-03-04 08:42:03 PST	2022-03-04	08:42:03	-0700	311460724	malgault	Matthew Gault		The issue also includes a fantastic contribution by my office mate @ciarapower_1, making the case for a feminist anthropology on our island  https://t.co/yNKOHr19vZ	en	[{'screen_name': 'ciarapower_1', 'name': 'ciara power', 'id': '953691387492552704'}]	['https://journals.ucc.ie/index.php/irishjournalofanthropology/article/view/3892']	[]	0	3	3	[]	[]	https://twitter.com/MALGault/status/1499787267711422469	False		0								[]				
1498391696521969673	1498356796930633731	2022-02-28 12:16:33 PST	2022-02-28	12:16:33	-0700	14729597	kateclancy	Dr. Kate Clancy 🏳️‍🌈		@rinewithoutacat Yeah, been thinking about this too, in a horrified way. I'd love to see the Association of Feminist Anthropology take this one, or a special issue of Anthropology News.	en	[]	[]	[]	1	0	2	[]	[]	https://twitter.com/KateClancy/status/1498391696521969673	False		0								[{'screen_name': 'rinewithoutacat', 'name': 'Rine does indeed have a cat', 'id': '2873884427'}]				
1498329769724764168	1498329769724764168	2022-02-28 08:10:29 PST	2022-02-28	08:10:29	-0700	15919583	daymonjhartley	Daymon J. Hartley (He/him/his)		Bury Class Society Before It Buries Us All: Eleanor Burke Leacock’s Vision for a Marxist Feminist Anthropology  https://t.co/U6ljxHpidp	en	[]	['https://monthlyreview.org/2022/02/01/bury-class-society-before-it-buries-us-all/']	[]	0	0	1	[]	[]	https://twitter.com/daymonjhartley/status/1498329769724764168	False		0								[]				
1497364377787371523	1497364377787371523	2022-02-25 16:14:22 PST	2022-02-25	16:14:22	-0700	1250508258235777024	marisaruiztrejo	Marisa Ruiz Trejo		Today I had the visit of Subhadra Channa, a referent of the anthropology of women. She is a powerful voice that give us hope and an influential figure for feminist anthropology. I feel very honored to share with her my last day @ILASColumbia and @cemeca_columbia 💜🖤  https://t.co/8OObrZ6cyI	en	[{'screen_name': 'ilascolumbia', 'name': 'ilas | columbia university', 'id': '946932368'}, {'screen_name': 'cemeca_columbia', 'name': 'cemeca | columbia university', 'id': '2304954055'}]	[]	['https://pbs.twimg.com/media/FMe09zNWYAQnWoJ.jpg']	0	0	5	[]	[]	https://twitter.com/MarisaRuizTrejo/status/1497364377787371523	False		1	https://pbs.twimg.com/media/FMe09zNWYAQnWoJ.jpg							[]				
1496883052756221955	1496862901163986944	2022-02-24 08:21:45 PST	2022-02-24	08:21:45	-0700	1412074096544845827	beditarini	Tarini Bedi		@FeministJournal Thank you @FeministJournal! What a privilege to be a Feminist Anthropology author and also want to acknowledge my wonderful co-writers and feminist PhD students from whom I have learned enormously @Lakshit59976109, Josephine Chaet, and Aditi Aggarwal!	en	[{'screen_name': 'feministjournal', 'name': 'feminist anthropology journal', 'id': '1192564385253928965'}, {'screen_name': 'lakshit59976109', 'name': 'lakshita', 'id': '1032810746881748997'}]	[]	[]	0	2	7	[]	[]	https://twitter.com/BediTarini/status/1496883052756221955	False		0								[{'screen_name': 'FeministJournal', 'name': 'Feminist Anthropology Journal', 'id': '1192564385253928965'}]				
1496183913856782342	1496183913856782342	2022-02-22 10:03:37 PST	2022-02-22	10:03:37	-0700	928773804	aaronwistar	Aaron Wistar		A great piece on the unjustly forgotten Marxist Feminist anthropology of Eleanor Burke Leacock.  @monthly_review   https://t.co/lsOqlPbNx3	en	[{'screen_name': 'monthly_review', 'name': 'monthly review', 'id': '308631257'}]	['https://monthlyreview.org/2022/02/01/bury-class-society-before-it-buries-us-all/']	[]	1	1	2	[]	[]	https://twitter.com/aaronwistar/status/1496183913856782342	False		0								[]				
1495497419093590018	1495497419093590018	2022-02-20 12:35:44 PST	2022-02-20	12:35:44	-0700	15652511	bwog	Bwog		"Staff Writer Dominic Wiharso attended ""Feminist Anthropologies In Mexico,"" a book presentation featuring scholars and authors from across the field of feminist anthropology.  https://t.co/NJaV9BHbq4"	en	[]	['https://bwog.com/2022/02/feminist-mexican-narratives-a-new-rubric-for-anthropologic-scholarship/']	[]	0	0	0	[]	[]	https://twitter.com/bwog/status/1495497419093590018	False		0								[]				
1494587464559779841	1494587464559779841	2022-02-18 00:19:54 PST	2022-02-18	00:19:54	-0700	3351872170	tecnorojo	TecnoRojo		Bury Class Society Before It Buries Us All: Eleanor Burke Leacock’s Vision for a Marxist Feminist Anthropology  https://t.co/zVLZHeAh0U	en	[]	['https://www.reddit.com/r/socialism/comments/suseps/bury_class_society_before_it_buries_us_all/']	[]	0	0	0	[]	[]	https://twitter.com/tecnorojo/status/1494587464559779841	False		0								[]				
1493689472092880901	1493689472092880901	2022-02-15 12:51:36 PST	2022-02-15	12:51:36	-0700	1457332834973196288	sinedjib	Nedjib SIDI MOUSSA		Bury Class Society Before It Buries Us All: Eleanor Burke Leacock’s Vision for a Marxist Feminist Anthropology  https://t.co/uveKOJv4L4	en	[]	['https://monthlyreview.org/2022/02/01/bury-class-society-before-it-buries-us-all/']	[]	0	0	2	[]	[]	https://twitter.com/sinedjib/status/1493689472092880901	False		0								[]				
1493052011486588935	1493052011486588935	2022-02-13 18:38:33 PST	2022-02-13	18:38:33	-0700	1172747403763638272	drdanaaindavis	Dana Davis		Feminist Anthropology @FeministJournal	en	[{'screen_name': 'feministjournal', 'name': 'feminist anthropology journal', 'id': '1192564385253928965'}]	[]	[]	0	2	5	[]	[]	https://twitter.com/drdanaaindavis/status/1493052011486588935	False	https://twitter.com/LabSpecEth/status/1493020169672675329	0								[]				
1492541677621362690	1492541677621362690	2022-02-12 08:50:40 PST	2022-02-12	08:50:40	-0700	281440041	_alice_evans	Alice Evans		OK! I have condensed the entire literature on the origins of patriarchy into 10 hypotheses.   I think this is everything from feminist anthropology, archaeology, history, economics and genetics??  Lmk if you think I’ve missed anything out! 😬  https://t.co/LFmC9BFc0j	en	[]	[]	['https://pbs.twimg.com/media/FLaSvhUXEAIgQbi.jpg']	72	332	1654	[]	[]	https://twitter.com/_alice_evans/status/1492541677621362690	False		1	https://pbs.twimg.com/media/FLaSvhUXEAIgQbi.jpg							[]				
1492320559274758144	1492320559274758144	2022-02-11 18:12:01 PST	2022-02-11	18:12:01	-0700	214886970	drlearnalot	drlearnalot, RL voodoo doll		Bury Class Society Before It Buries Us All: Eleanor Burke Leacock’s Vision for a Marxist Feminist Anthropology  https://t.co/2Ut8Kz0q1U	en	[]	['https://monthlyreview.org/2022/02/01/bury-class-society-before-it-buries-us-all/']	[]	0	1	1	[]	[]	https://twitter.com/DrLearnALot/status/1492320559274758144	False		0								[]				
1491588138241777665	1491584673574703104	2022-02-09 17:41:39 PST	2022-02-09	17:41:39	-0700	2909691652	manigarm	Dr. Holly Walters		Abstract: This essay engages with the promise of feminist anthropology in terms of a disconnect between the practice of modern anthropology, its commitment to critically unveiling the narratives of power, and the structures of the academy, beholden as it is to...	en	[]	[]	[]	1	1	8	[]	[]	https://twitter.com/Manigarm/status/1491588138241777665	False		0								[]				
1491194940302725121	1491194940302725121	2022-02-08 15:39:13 PST	2022-02-08	15:39:13	-0700	389038271	josvix	José Marques Porto		Bury Class Society Before It Buries Us All: Eleanor Burke Leacock’s Vision for a Marxist Feminist Anthropology -  https://t.co/8pUsPFZTSC	en	[]	['http://eepurl.com/hTCNjz']	[]	0	0	1	[]	[]	https://twitter.com/JosVix/status/1491194940302725121	False		0								[]				
1490812127271174144	1490812127271174144	2022-02-07 14:18:03 PST	2022-02-07	14:18:03	-0700	2792096925	cascatweet	CASCA		CASCA Women's Network 2022 Award for Student Paper in Feminist Anthropology/ Prix étudiant du Réseau des femmes de la CASCA 2022 Deadline: 20 February / date limite : le 20 février  https://t.co/MhZUP9Rbmj #cdnanth	fr	[]	['https://cas-sca.ca/student-zone-notices/30455-casca-women-s-network-2022-award-for-student-paper-in-feminist-anthropology-prix-etudiant-du-reseau-des-femmes-de-la-casca-2022']	[]	0	0	0	['cdnanth']	[]	https://twitter.com/CASCATweet/status/1490812127271174144	False		0								[]				
1490734939456868354	1490734939456868354	2022-02-07 09:11:20 PST	2022-02-07	09:11:20	-0700	1250508258235777024	marisaruiztrejo	Marisa Ruiz Trejo		Very happy to share my work as an O'Gorman Fellow at @ILASColumbia and @cemeca_columbia. I will focus on  some important thinkers for feminist anthropology in Chiapas, Southern Mexico, and Central America, between the 1970s and 1990s.	en	[{'screen_name': 'ilascolumbia', 'name': 'ilas | columbia university', 'id': '946932368'}, {'screen_name': 'cemeca_columbia', 'name': 'cemeca | columbia university', 'id': '2304954055'}]	[]	[]	0	4	15	[]	[]	https://twitter.com/MarisaRuizTrejo/status/1490734939456868354	False	https://twitter.com/ILASColumbia/status/1489643854320082944	0								[]				
1490082627893841928	1490082627893841928	2022-02-05 13:59:17 PST	2022-02-05	13:59:17	-0700	878579643435147264	malahierbacomun	Malahierba Comùn		Bury Class Society Before It Buries Us All: Eleanor Burke Leacock’s Vision for a Marxist Feminist Anthropology  https://t.co/lxHrCDZkzu	en	[]	['https://monthlyreview.org/2022/02/01/bury-class-society-before-it-buries-us-all/']	[]	0	0	1	[]	[]	https://twitter.com/MalahierbaComun/status/1490082627893841928	False		0								[]				
1488950364116328451	1488950364116328451	2022-02-02 11:00:04 PST	2022-02-02	11:00:04	-0700	2792096925	cascatweet	CASCA		CASCA Women's Network 2022 Award for Student Paper in Feminist Anthropology/ Prix étudiant du Réseau des femmes de la CASCA 2022 Deadline: 20 February / date limite : le 20 février  https://t.co/MhZUP9Rbmj #cdnanth	fr	[]	['https://cas-sca.ca/student-zone-notices/30455-casca-women-s-network-2022-award-for-student-paper-in-feminist-anthropology-prix-etudiant-du-reseau-des-femmes-de-la-casca-2022']	[]	0	2	1	['cdnanth']	[]	https://twitter.com/CASCATweet/status/1488950364116328451	False		0								[]				
1487819767654330370	1487819767654330370	2022-01-30 08:07:29 PST	2022-01-30	08:07:29	-0700	172143017	mcclaurintweets	Dr. Irma McClaurin, speaking only for myself		Goodreads my #sistah @Elena_Herminia for @citeblackwomen Sunday! What abt  #KeshoScott, The Habit of Surviving or Anne Moody’s Coming of Age in Mississippi? Also my edited Black Feminist Anthropology written autoethnographically on how personal history shaped their anthropology.  https://t.co/L3Qwp3gy9b	en	"[{'screen_name': 'elena_herminia', 'name': ""zora's eyes"", 'id': '988939394282348557'}, {'screen_name': 'citeblackwomen', 'name': 'cite black women.', 'id': '941829517273944064'}]"	[]	['https://pbs.twimg.com/media/FKXMMLBXwAMXVGY.jpg']	0	0	3	['sistah', 'keshoscott']	[]	https://twitter.com/mcclaurintweets/status/1487819767654330370	False	https://twitter.com/Elena_Herminia/status/1487523333642063875	1	https://pbs.twimg.com/media/FKXMMLBXwAMXVGY.jpg							[]				
1486097961276817412	1485921185250652161	2022-01-25 14:05:38 PST	2022-01-25	14:05:38	-0700	2380615880	sdbreslin	Sam Breslin		@macdougallsm Also @rgwhitaker's Politics of Friendship in Feminist Anthropology  https://t.co/jw6fmqgjV6	en	[{'screen_name': 'rgwhitaker', 'name': 'robin whitaker', 'id': '3030326800'}]	['https://www.berghahnjournals.com/view/journals/aia/18/1/aia180107.xml']	[]	1	0	2	[]	[]	https://twitter.com/sdbreslin/status/1486097961276817412	False		0								[{'screen_name': 'macdougallsm', 'name': 'Susan MacDougall', 'id': '64974957'}]				
1485586221107748864	1485586221107748864	2022-01-24 04:12:10 PST	2022-01-24	04:12:10	-0700	2792096925	cascatweet	CASCA		CASCA Women's Network 2022 Award for Student Paper in Feminist Anthropology/ Prix étudiant du Réseau des femmes de la CASCA 2022 Deadline: 20 February 2022 / date limite : le 20 février 2022  https://t.co/MhZUP9Rbmj #cdnanth	fr	[]	['https://cas-sca.ca/student-zone-notices/30455-casca-women-s-network-2022-award-for-student-paper-in-feminist-anthropology-prix-etudiant-du-reseau-des-femmes-de-la-casca-2022']	[]	0	0	0	['cdnanth']	[]	https://twitter.com/CASCATweet/status/1485586221107748864	False		0								[]				
1484524843777286145	1484524843777286145	2022-01-21 05:54:38 PST	2022-01-21	05:54:38	-0700	2792096925	cascatweet	CASCA		CASCA Women's Network 2022 Award for Student Paper in Feminist Anthropology/ Prix étudiant du Réseau des femmes de la CASCA 2022 Deadline: 20 February 2022 / date limite : le 20 février 2022  https://t.co/MhZUP9Rbmj #cdnanth	fr	[]	['https://cas-sca.ca/student-zone-notices/30455-casca-women-s-network-2022-award-for-student-paper-in-feminist-anthropology-prix-etudiant-du-reseau-des-femmes-de-la-casca-2022']	[]	0	1	0	['cdnanth']	[]	https://twitter.com/CASCATweet/status/1484524843777286145	False		0								[]				
1484326694106267649	1483935717147672576	2022-01-20 16:47:15 PST	2022-01-20	16:47:15	-0700	749266020288921600	afleisch_anthro	Adam Fleischmann		"@corvidresearch ! Reminds me of Emily Martin's classic article in feminist anthropology of science ""The Egg and the Sperm."" Uses the language of late 80s/early 90s but clearly lays out how gender bias in reproductive biology effects what so many see as Objective Science:  https://t.co/WwMgPwPNNd"	en	[]	['https://web.stanford.edu/~eckert/PDF/Martin1991.pdf']	[]	0	0	0	[]	[]	https://twitter.com/afleisch_anthro/status/1484326694106267649	False		0								[{'screen_name': 'corvidresearch', 'name': 'Kaeli Swift, Ph.D.', 'id': '2967402199'}]				
