id	conversation_id	created_at	date	time	timezone	user_id	username	name	place	tweet	language	mentions	urls	photos	replies_count	retweets_count	likes_count	hashtags	cashtags	link	retweet	quote_url	video	thumbnail	near	geo	source	user_rt_id	user_rt	retweet_id	reply_to	retweet_date	translate	trans_src	trans_dest
1377310771768557568	1377310771768557568	2021-03-31 10:24:11 PDT	2021-03-31	10:24:11	-0700	1352390298484101122	thatanthropod	Gabriella Campbell		Another TWO guests this week! Get ready for all things feminism and women supporting women discussed with the lovely Dr. Michelle Ramirez (speaking in clip) and Dr. Srimati Basu who are both members of the Association of Feminist Anthropology a subsect of the @AmericanAnthro  https://t.co/5K0QbYyQa8	en	[{'screen_name': 'americananthro', 'name': 'american anthropological association', 'id': '42914038'}]	[]	[]	1	0	3	[]	[]	https://twitter.com/ThatAnthroPod/status/1377310771768557568	False		1	https://pbs.twimg.com/ext_tw_video_thumb/1377310712150650883/pu/img/4Mb2INtM15imNrw0.jpg							[]				
1375616792761106432	1374998362890584064	2021-03-26 18:12:55 PDT	2021-03-26	18:12:55	-0700	1270364924905226243	debatante	complex		@nyctemere @bloke255 @KirstySNP @rachel__julia @leftist_rage it’s inherently biologically motivated. this control has cascaded in the misogynistic patriarchal structures that most cultures exhibit today. to deny this is, to be frank..a sign of not understanding the root cause, likely due to being uninformed regarding feminist anthropology.	en	[]	[]	[]	1	0	0	[]	[]	https://twitter.com/debatante/status/1375616792761106432	False		0								[{'screen_name': 'nyctemere', 'name': 'Nyctémère', 'id': '1071486833849192448'}, {'screen_name': 'bloke255', 'name': 'Random Bloke 💜🤍💚🌻', 'id': '1026822583101083649'}, {'screen_name': 'KirstySNP', 'name': 'Kirsty Blackman', 'id': '2616215901'}, {'screen_name': 'rachel__julia', 'name': 'Rachel Julia', 'id': '700667578062999552'}]				
1375467670670311431	1375467667767844869	2021-03-26 08:20:22 PDT	2021-03-26	08:20:22	-0700	216453098	aba_aaa	Assoc4BlackAnthro		3/4  Recipients will receive Negras in Brazil by Dr. @KiaLCaldwell , Black Feminist Anthropology edited by @mcclaurintweets , and Shapeshifters by @aimee_meredith_ which we will discuss with Dr. Cox at the inaugural #PathwaysBookClub inaugural meeting on 3/31!	en	[{'screen_name': 'kialcaldwell', 'name': 'kl caldwell', 'id': '1881235969'}, {'screen_name': 'mcclaurintweets', 'name': 'dr. irma mcclaurin, speaking only for myself', 'id': '172143017'}, {'screen_name': 'aimee_meredith_', 'name': 'aimee meredith cox', 'id': '19220024'}]	[]	[]	1	0	5	['pathwaysbookclub']	[]	https://twitter.com/ABA_AAA/status/1375467670670311431	False		0								[]				
1375139420211384323	1375139420211384323	2021-03-25 10:36:01 PDT	2021-03-25	10:36:01	-0700	248795646	columbia	Columbia University		"What inspired Alyssa James and Brendane Tynes, PhD students in Anthropology to start their Black feminist anthropology podcast, Zora's Daughters? ""I started to see Zora Neale Hurston as my forebear, myself a “daughter” of Zora.""  https://t.co/c4zdgMemIr #BlackHistoryNow"	en	[]	['http://bit.ly/2YLYQNq']	[]	1	3	10	['blackhistorynow']	[]	https://twitter.com/Columbia/status/1375139420211384323	False		0								[]				
1372673391845511172	1372673391845511172	2021-03-18 15:16:54 PDT	2021-03-18	15:16:54	-0700	718550217268670464	ucsbreligion	UCSB Religious Studies		Take a look at Professor Pérez's latest article (#FreeAccess) in the Feminist Anthropology Journal. #ReligiousStudies	fr	[]	[]	[]	0	2	6	['freeaccess', 'religiousstudies']	[]	https://twitter.com/UCSBReligion/status/1372673391845511172	False	https://twitter.com/FeministJournal/status/1372548346150330368	0								[]				
1372045771642564608	1372040952915841025	2021-03-16 21:42:57 PDT	2021-03-16	21:42:57	-0700	522365928	vickifrogqueen	Vicki 🌊 🇺🇸 🐈 🕎 🌈 🐸 🌎 🇺🇦 StandWithUkraine		"@Jason_elAvocado ""Cannibal Women In The Avocado Jungle Of Death"".  its so bad it's roll on the floor funny ... To avoid a serious avocado shortage, the U.S. Gov. hires feminist anthropology professor to find the man-eating Piranha Women tribe who inhabit the avocado jungle of Southern California."	en	[]	[]	[]	4	0	11	[]	[]	https://twitter.com/vickifrogqueen/status/1372045771642564608	False		0								[{'screen_name': 'Jason_elAvocado', 'name': 'JJD 🔭🗽🌍📕🌊', 'id': '18680259'}]				
1371410255729590273	1371407330420609025	2021-03-15 03:37:39 PDT	2021-03-15	03:37:39	-0700	2969942501	debraferreday	Debra Ferreday		@_daisymaybarker Irma McLaurin's Black Feminist Anthropology,  Nayanika Mookherjee (obvs), Adi Kuntsman for feminist + queer/online ethnography, plus all the classic stuff like Mohanty, Stacey which you probs already know!	en	[]	[]	[]	1	0	1	[]	[]	https://twitter.com/DebraFerreday/status/1371410255729590273	False		0								[{'screen_name': '_daisymaybarker', 'name': 'Daisy May Barker', 'id': '4098244557'}]				
1370604831270825987	1370604831270825987	2021-03-12 21:17:11 PST	2021-03-12	21:17:11	-0700	824449849923772416	thirana1	Sharika Thiranagama		Black Feminist Plots before the Plantationocene and Anthropology's “Regional Closets” - Jegathesan - - Feminist Anthropology - Wiley Online Library   https://t.co/FOm9jc8GMg	en	[]	['https://anthrosource.onlinelibrary.wiley.com/doi/10.1002/fea2.12037#.YExF6W6o0Mc.twitter']	[]	1	4	37	[]	[]	https://twitter.com/thirana1/status/1370604831270825987	False		0								[]				
1370367532339716104	1370367532339716104	2021-03-12 05:34:14 PST	2021-03-12	05:34:14	-0700	55631363	rg_martinez	Rebecca Martinez		Feminist Anthropology for Our Times | Anthropology News  https://t.co/MdMCa8QzCm	en	[]	['https://www.anthropology-news.org/index.php/2019/08/26/feminist-anthropology-for-our-times/#.YEttzToyKwI.twitter']	[]	0	0	0	[]	[]	https://twitter.com/RG_Martinez/status/1370367532339716104	False		0								[]				
1370106052218400771	1370106052218400771	2021-03-11 12:15:12 PST	2021-03-11	12:15:12	-0700	42914038	americananthro	American Anthropological Association		We’re thrilled to partner with the Association for Feminist #Anthropology (@femanth) to celebrate and honor some of their colleagues and mentors for #WomensHistoryMonth!  Meet Ellen Lewin, Professor Emeritus of Women’s Studies and Anthropology at @uiowa.  https://t.co/319pf4sigK	en	[{'screen_name': 'femanth', 'name': 'association for feminist anthropology', 'id': '422375034'}, {'screen_name': 'uiowa', 'name': 'university of iowa', 'id': '14534931'}]	[]	['https://pbs.twimg.com/media/EwOYMT6XEBUD07j.jpg']	0	0	13	['anthropology', 'womenshistorymonth']	[]	https://twitter.com/AmericanAnthro/status/1370106052218400771	False		1	https://pbs.twimg.com/media/EwOYMT6XEBUD07j.jpg							[]				
1369850976954245121	1369642990487146498	2021-03-10 19:21:38 PST	2021-03-10	19:21:38	-0700	1038834629908656129	uboatheflesh	🅄🄱🄾🄰		@tigre_moutarde @Category_Fury Like the fact that Japan can successfully export all this loli shit and the west laps it up means the same values are there, we just disavow it whereas Japan is more honest in comparison. Would love to read some comparative feminist anthropology on this.	en	[]	[]	[]	2	0	3	[]	[]	https://twitter.com/Uboatheflesh/status/1369850976954245121	False		0								[{'screen_name': 'tigre_moutarde', 'name': 'tigre moutarde', 'id': '1254781364655685636'}, {'screen_name': 'Category_Fury', 'name': 'Olivia (of the Satanic mode)', 'id': '861976616678772736'}]				
1369382013908758535	1369382013908758535	2021-03-09 12:18:08 PST	2021-03-09	12:18:08	-0700	52076577	illinoispress	Illinois Press		The Pluralist, 16.1, Against Discursive Colonialism: Intercultural Dialogues as a Path to Decolonizing Feminist Anthropology, R. Aída Hernández Castillo. Cultures &amp; practices of violence are affecting our communities on both sides of the border.  https://t.co/7rEPQ3r5hf @femanth  https://t.co/zJ4BN2lLxD	en	[{'screen_name': 'femanth', 'name': 'association for feminist anthropology', 'id': '422375034'}]	['https://bit.ly/3sErKvI']	['https://pbs.twimg.com/media/EwEFQGjXEBETwB8.png']	4	0	0	[]	[]	https://twitter.com/IllinoisPress/status/1369382013908758535	False		1	https://pbs.twimg.com/media/EwEFQGjXEBETwB8.png							[]				
1367232552168136706	1367232552168136706	2021-03-03 13:56:57 PST	2021-03-03	13:56:57	-0700	2613485677	rjepiobwarrior	Karen A Scott MD MPH FACOG		“The Rise of Black Feminist Intellectual Thought &amp; Political Activism in Perinatal Quality Improvement: A Righteous Rage about Racism, Resistance, Resilience, &amp; Rigor”  Congratulations on the acceptance of your article for publication in Feminist Anthropology. @FeministJournal	en	[{'screen_name': 'feministjournal', 'name': 'feminist anthropology journal', 'id': '1192564385253928965'}]	[]	[]	6	21	128	[]	[]	https://twitter.com/RJEpiOBWarrior/status/1367232552168136706	False		0								[]				
1367133595089911816	1367133595089911816	2021-03-03 07:23:43 PST	2021-03-03	07:23:43	-0700	950928132848214017	biancaphd	Bianca C. Williams		Y'all, @ratnagiri77 and @drdanaaindavis have been doing their THING as editors bringing the journal, Feminist Anthropology to life. Here is the CFP for an upcoming issue--submissions due May 30. Looking forward to reading YOUR future work.	en	[{'screen_name': 'ratnagiri77', 'name': 'sameena mulla (she/her)', 'id': '48824213'}, {'screen_name': 'drdanaaindavis', 'name': 'dana davis', 'id': '1172747403763638272'}]	[]	[]	0	4	20	[]	[]	https://twitter.com/biancaphd/status/1367133595089911816	False	https://twitter.com/FeministJournal/status/1367114530187333632	0								[]				
1365873389437607940	1365013075552780301	2021-02-27 19:56:07 PST	2021-02-27	19:56:07	-0700	14571646	spiritcitizen	Fadeke Castor 🇹🇹💜🇳🇬		@mpgPhD @MicahTParker Aaaawww thanks so much! 😊 Pleasure to be included among amazing scholars of ADR and Black feminist anthropology. Grateful for all those that came before and all those who are walking/working together now.  #citeblackwomen  https://t.co/UBsnSGxOdK	en	[]	[]	['https://pbs.twimg.com/tweet_video_thumb/EvSOmiRWQAMWJrF.jpg']	0	0	3	['citeblackwomen']	[]	https://twitter.com/spiritcitizen/status/1365873389437607940	False		1	https://pbs.twimg.com/tweet_video_thumb/EvSOmiRWQAMWJrF.jpg							[{'screen_name': 'mpgPhD', 'name': 'Prof. Megan Goodwin', 'id': '246565746'}]				
1365404318145253376	1365389418580766721	2021-02-26 12:52:12 PST	2021-02-26	12:52:12	-0700	4657994587	neurosarda	Daniela Saderi, PhD		They are representing the collective work of the @citeblackwomen movement giving us a snapshot into an upcoming statement on Feminist Anthropology. There are a few pieces out in this special issue but keep a look out for the statement coming up soon  https://t.co/74klt6SESb	en	[{'screen_name': 'citeblackwomen', 'name': 'cite black women.', 'id': '941829517273944064'}]	['https://anthrosource.onlinelibrary.wiley.com/journal/26437961']	[]	1	1	4	[]	[]	https://twitter.com/Neurosarda/status/1365404318145253376	False		0								[]				
1363964344313217025	1363964344313217025	2021-02-22 13:30:15 PST	2021-02-22	13:30:15	-0700	752783162049171456	anthroencyclo	Anthropology Encyclopedia		New #podcast episode by @Zoras_Daughters: A discussion of #Black elders, ancestors, &amp; Black #Feminist #anthropology w/ Associate Professor and President of the Association of Black Anthropologists (@ABA_AAA) Dr. Riché J. Daniel Barnes (@DrRJDBarnes)  https://t.co/mNQQQJZIsl	en	"[{'screen_name': 'zoras_daughters', 'name': ""zora's daughters podcast"", 'id': '1266063319250714625'}, {'screen_name': 'aba_aaa', 'name': 'assoc4blackanthro', 'id': '216453098'}, {'screen_name': 'drrjdbarnes', 'name': 'riché jdaniel barnes', 'id': '3372589307'}]"	['http://ow.ly/haZO50DEx7K']	[]	1	2	8	['podcast', 'black', 'feminist', 'anthropology']	[]	https://twitter.com/anthroencyclo/status/1363964344313217025	False		0								[]				
1363480085819449351	1363238841470099465	2021-02-21 05:25:59 PST	2021-02-21	05:25:59	-0700	3317777511	mccreadiejoanna	Joanna McCreadie		@AnnieCCPS @Sophy_Green Was it Betty Friedman that wrote a book about this?  Lots of feminist anthropology about how culture shapes women’s ‘work’ and located in the home/family domain eg the Sunday dinner tradition	en	[]	[]	[]	0	0	1	[]	[]	https://twitter.com/McCreadieJoanna/status/1363480085819449351	False		0								[{'screen_name': 'AnnieCCPS', 'name': 'Annie Gunner Logan', 'id': '1283714582247350272'}, {'screen_name': 'Sophy_Green', 'name': 'Sophy Green', 'id': '50606562'}]				
1363342315130155008	1363342315130155008	2021-02-20 20:18:32 PST	2021-02-20	20:18:32	-0700	952270656728719360	lucien_baskin	The Great Moving Left Show		Taking a Black feminist anthropology class with Prof. Williams this spring and thinking about the people who made this space possible at CUNY, in particular President Cole and the late Dr. Leith Mullings  https://t.co/7hliRbNFci	en	[]	[]	['https://pbs.twimg.com/media/EuuQnANXAAA4GY9.jpg']	1	2	19	[]	[]	https://twitter.com/lucien_baskin/status/1363342315130155008	False		1	https://pbs.twimg.com/media/EuuQnANXAAA4GY9.jpg							[]				
1363113124572909570	1363113124572909570	2021-02-20 05:07:48 PST	2021-02-20	05:07:48	-0700	172143017	mcclaurintweets	Dr. Irma McClaurin, speaking only for myself		Believe it or not @debrarodmanva “Women of Belize” in print 24 years &amp; “Black Feminist Anthropology” is 20 yrs in2021. Thanks @RutgersUPress 4 publishing both! My #legacy now is supporting the “Irma McClaurin” #BlackFeministArchive at @UMassAmherst  w: @scua_umass &amp; @DuBoisUMass	en	[{'screen_name': 'debrarodmanva', 'name': 'debra h. rodman', 'id': '38206298'}, {'screen_name': 'rutgersupress', 'name': 'rutgers university press', 'id': '621047794'}, {'screen_name': 'umassamherst', 'name': 'umass amherst', 'id': '19874736'}, {'screen_name': 'scua_umass', 'name': 'umass amherst scua', 'id': '106112780'}, {'screen_name': 'duboisumass', 'name': 'w. e. b. du bois center', 'id': '3327103749'}]	[]	[]	0	0	0	['legacy', 'blackfeministarchive']	[]	https://twitter.com/mcclaurintweets/status/1363113124572909570	False	https://twitter.com/debrarodmanva/status/1363086108465258498	0								[]				
1363086108465258498	1363081093633740800	2021-02-20 03:20:27 PST	2021-02-20	03:20:27	-0700	38206298	debrarodmanva	Debra H. Rodman		From her many publications, I cherish “Women of Belize: Gender and Change in Central America” and “Black Feminist Anthropology.”  Her Black Feminist Archive is housed at @amherstlibrary Dr. McClaurin continues to speak and publish widely. TY! #BlackHistoryMonth #citeblackwomen  https://t.co/Ds0jgHqbrp	en	[{'screen_name': 'amherstlibrary', 'name': 'amherst college library', 'id': '289968746'}]	[]	['https://pbs.twimg.com/media/Euqnl30WYAAZcXm.jpg']	0	1	4	['blackhistorymonth', 'citeblackwomen']	[]	https://twitter.com/debrarodmanva/status/1363086108465258498	False		1	https://pbs.twimg.com/media/Euqnl30WYAAZcXm.jpg							[]				
1362771953602428931	1362771953602428931	2021-02-19 06:32:07 PST	2021-02-19	06:32:07	-0700	381515516	collabdocs	Mandy J Rose		The making of a magazine. @alicequigley inspiring on how @Container_Mag [Human Adventures in Creative Technology] draws from Ursula LeGuin's feminist anthropology, DIY culture and the practice of commoning.  https://t.co/WDD8awAQa1	en	[{'screen_name': 'alicequigley', 'name': 'alice quigley', 'id': '19019846'}, {'screen_name': 'container_mag', 'name': 'container', 'id': '1275809673573208070'}]	['https://www.youtube.com/watch?v=0p50tNMv0Xs']	[]	2	2	5	[]	[]	https://twitter.com/CollabDocs/status/1362771953602428931	False		0								[]				
1362090636606902273	1362090636606902273	2021-02-17 09:24:48 PST	2021-02-17	09:24:48	-0700	1266063319250714625	zoras_daughters	Zora's Daughters Podcast		📣New Episode📣  We discuss our elders, ancestors, &amp; Black Feminist anthropology w/ Associate Professor and President of the Association of Black Anthropologists, Dr. Riché J. Daniel Barnes @DrRJDBarnes!  #AnthroTwitter #AcademicChatter #AcademicTwitter #PhDChat #BHM  https://t.co/xGshiNMxx6	en	[{'screen_name': 'drrjdbarnes', 'name': 'riché jdaniel barnes', 'id': '3372589307'}]	[]	['https://pbs.twimg.com/media/EuceNy8XAAU35QP.jpg']	0	20	49	['anthrotwitter', 'academicchatter', 'academictwitter', 'phdchat', 'bhm']	[]	https://twitter.com/Zoras_Daughters/status/1362090636606902273	False		1	https://pbs.twimg.com/media/EuceNy8XAAU35QP.jpg							[]				
1361813010122117120	1361800477944479745	2021-02-16 15:01:37 PST	2021-02-16	15:01:37	-0700	22673799	rachelfudge	Rachel Fudge		@byjennytan @Sonnet_Fitz 👋 That's me! I've copyedited many anthro books for university presses, as well as articles for scholarly journals (incl. Alaska Journal of Anthropology, Feminist Anthropology, and Visual Anthro. Review). Feel free to DM me or see my website:  https://t.co/FYJUrhPXce	en	[]	['http://rachelfudge.com']	[]	2	0	7	[]	[]	https://twitter.com/RachelFudge/status/1361813010122117120	False		0								[{'screen_name': 'byjennytan', 'name': 'Jenny Tan', 'id': '1010696067015376896'}, {'screen_name': 'Sonnet_Fitz', 'name': 'Sonnet Fitzgerald', 'id': '860148997'}]				
1361314120922988544	1361314120922988544	2021-02-15 05:59:13 PST	2021-02-15	05:59:13	-0700	2494206019	allergyphd	Danya Glabau		A thing I’m thinking about this morning yet again, as I gain so much personally + scholarly from recent reads, is how actively I was discouraged from reading feminist anthropology and feminist STS in grad school. Black feminist anthropology was completely invisible.	en	[]	[]	[]	2	4	29	[]	[]	https://twitter.com/allergyPhD/status/1361314120922988544	False	https://twitter.com/allergyPhD/status/1361149329403219972	0								[]				
1360508301406965760	1360494307682131968	2021-02-13 00:37:10 PST	2021-02-13	00:37:10	-0700	21495403	irenemarquette	Irene Marquette		@TDQueso Hmm good idea now watch me ditch those classes, audit “feminist anthropology of the Fertile Crescent” where I do ALL the reading and eventually drop out earning no degrees. 😛	en	[]	[]	[]	0	0	8	[]	[]	https://twitter.com/IreneMarquette/status/1360508301406965760	False		0								[{'screen_name': 'TDQueso', 'name': 'Tyler Dean Kempf', 'id': '2540284883'}]				
1359506737041145856	1359506737041145856	2021-02-10 06:17:19 PST	2021-02-10	06:17:19	-0700	2479124396	catherinelasota	Catherine LaSota		New episode of the @socialdiff #JustThree podcast today! I was fortunate to interview amazing Black feminist anthropology student Alyssa A.L. James, co-host of the @zoras_daughters podcast. Topics include Franz Fanon, Youssou N’Dour, &amp; more!  https://t.co/h8LPAIeAja	en	"[{'screen_name': 'socialdiff', 'name': 'social difference at columbia', 'id': '473334345'}, {'screen_name': 'zoras_daughters', 'name': ""zora's daughters podcast"", 'id': '1266063319250714625'}]"	['https://podcasts.apple.com/us/podcast/just-three-alyssa-a-l-james/id1540088214?i=1000508449957']	[]	0	2	3	['justthree']	[]	https://twitter.com/CatherineLaSota/status/1359506737041145856	False		0								[]				
1359215540687011840	1359215540687011840	2021-02-09 11:00:12 PST	2021-02-09	11:00:12	-0700	1938869654	mgaspari2	michelle gaspari		in love with the course i'm taking on racism &amp; reproduction, &amp; feeling like i have strayed too far from gender theory and feminist anthropology. it can be difficult to remember the 'stick with what excites you' part of phD life, but its so real!	en	[]	[]	[]	1	0	8	[]	[]	https://twitter.com/mgaspari2/status/1359215540687011840	False		0								[]				
1357790031063244800	1357790031063244800	2021-02-05 12:35:44 PST	2021-02-05	12:35:44	-0700	248795646	columbia	Columbia University		"What inspired Alyssa James and Brendane Tynes, PhD students in Anthropology to start their Black feminist anthropology podcast, Zora's Daughters? ""I started to see Zora Neale Hurston as my forebear, myself a “daughter” of Zora.""  https://t.co/c4zdgMemIr #BlackHistoryNow  https://t.co/jMkGH8cQK8"	en	[]	['http://bit.ly/2YLYQNq']	['https://pbs.twimg.com/media/EtfW1U_WYAM0Fhc.jpg']	0	10	35	['blackhistorynow']	[]	https://twitter.com/Columbia/status/1357790031063244800	False		1	https://pbs.twimg.com/media/EtfW1U_WYAM0Fhc.jpg							[]				
1357070663052382218	1357070663052382218	2021-02-03 12:57:13 PST	2021-02-03	12:57:13	-0700	724844159920648193	helloannahorn	Anna Horn 🤎 She/Her		@drdanaaindavis Thank you for your scholarship. I'm a budding anthropologist and your work inspire and move me. #reproconvo2021 #maternalhealth #reproductivejustice #blackfeminism #feministanthropology #blackscholars	en	[]	[]	[]	1	0	1	['reproconvo2021', 'maternalhealth', 'reproductivejustice', 'blackfeminism', 'feministanthropology', 'blackscholars']	[]	https://twitter.com/helloannahorn/status/1357070663052382218	False		0								[]				
1356962036589158400	1356962036589158400	2021-02-03 05:45:35 PST	2021-02-03	05:45:35	-0700	3246365692	brownanthro	Brown Anthropology		"Our @BrownAnthro Spring 2021 Colloquia Speaker Series will begin with a presentation by Sarah Davenport, entitled ""Black Feminist Anthropology, Ethnography and Activism,” Friday, February 5th, at 12 noon. @BrownGradSchool @BrownUResearch  https://t.co/lnTjllsZnw"	en	[{'screen_name': 'brownanthro', 'name': 'brown anthropology', 'id': '3246365692'}, {'screen_name': 'browngradschool', 'name': 'brown grad school', 'id': '352317501'}, {'screen_name': 'brownuresearch', 'name': 'brown research', 'id': '824711162013028352'}]	[]	['https://pbs.twimg.com/media/EtTlalsXUAIT6SQ.jpg']	1	3	18	[]	[]	https://twitter.com/BrownAnthro/status/1356962036589158400	False		1	https://pbs.twimg.com/media/EtTlalsXUAIT6SQ.jpg							[]				
1354807485991804941	1354756754563870720	2021-01-28 07:04:10 PST	2021-01-28	07:04:10	-0700	49929218	steel_weaver	Steve Wheeler		@tomstafford Hm, yes, they are very viking-like, &amp; the north-east orientation could be the Baltic I suppose.  But the coincidence of name, direction &amp; difference in skin colouring strongly suggests Kurgan to me. ULG was very up on her (esp. feminist) anthropology, &amp; would have known G's work.	en	[]	[]	[]	1	0	0	[]	[]	https://twitter.com/steel_weaver/status/1354807485991804941	False		0								[{'screen_name': 'tomstafford', 'name': 'Tom Stafford', 'id': '11939852'}]				
1354595103596294147	1354595103596294147	2021-01-27 17:00:14 PST	2021-01-27	17:00:14	-0700	2792096925	cascatweet	CASCA		CASCA Women's Network 2021 Award for Student Paper in Feminist Anthropology  Prix étudiant du Réseau des femmes de la CASCA pour une communication d’un-e étudiant-e en anthropologie féministe  https://t.co/4kvTlT7Feh #cdnanth	fr	[]	['https://cas-sca.ca/student-zone-notices/24213-casca-women-s-network-2021-award-for-student-paper-in-feminist-anthropology-prix-etudiant-du-reseau-des-femmes-de-la-casca-pour-une-communication-d-un-e-etudiant-e-en-anthropologie-feministe']	[]	0	0	1	['cdnanth']	[]	https://twitter.com/CASCATweet/status/1354595103596294147	False		0								[]				
1354571103004364800	1354571103004364800	2021-01-27 15:24:52 PST	2021-01-27	15:24:52	-0700	751531004544716800	matthuntermcr	Matthew J. Hunter ☭		Just finished “The Origins of the Family, Private Property, and the State” by Engels  Found it a rather intriguing piece of feminist anthropology. If you want to understand how these social constructs formed through ancient societies, this is a worthwhile read.  https://t.co/sFECq9csRV	en	[]	[]	['https://pbs.twimg.com/media/EsxnPKCUUAEhG-i.jpg']	0	0	0	[]	[]	https://twitter.com/MattHunterMCR/status/1354571103004364800	False		1	https://pbs.twimg.com/media/EsxnPKCUUAEhG-i.jpg							[]				
1354490049048440832	1354490049048440832	2021-01-27 10:02:47 PST	2021-01-27	10:02:47	-0700	1637256811	thephdandme	Dr. Whitney Pirtle		"📨It is here - the piece I almost never shared with the world but encouragement on and off here pushed me to - thank you!   New out in Feminist Anthropology ""We, too, are academia: Demanding a seat at the table""    https://t.co/qwjk3SFoyt"	en	[]	['https://anthrosource.onlinelibrary.wiley.com/doi/10.1002/fea2.12030']	[]	9	28	144	[]	[]	https://twitter.com/thePhDandMe/status/1354490049048440832	False	https://twitter.com/thePhDandMe/status/1262156895172714497	0								[]				
1354212320432574465	1354212320432574465	2021-01-26 15:39:11 PST	2021-01-26	15:39:11	-0700	326802223	carlyschuster	Caroline Schuster		"Read about em(mask)ulation! Here's my #feministanthropology post on ""toxic maskulinity,"" COVID-19, domesticity in crisis, and gendered material culture. @ArchAnthANU @ANUcass @ANUAnthropology  https://t.co/aYPPPtpU13"	en	[{'screen_name': 'archanthanu', 'name': 'anu school of archaeology & anthropology', 'id': '2655603848'}, {'screen_name': 'anucass', 'name': 'anu cass', 'id': '2160262890'}, {'screen_name': 'anuanthropology', 'name': 'anu anthropology', 'id': '999453749528576000'}]	['https://www.policyforum.net/toxic-maskulinity/']	[]	0	5	10	['feministanthropology']	[]	https://twitter.com/CarlySchuster/status/1354212320432574465	False		0								[]				
1354116232237043712	1354116232237043712	2021-01-26 09:17:22 PST	2021-01-26	09:17:22	-0700	1227304056172900352	drsepinwall	Dr. Alyssa #StopHaitianDeportations Sepinwall		At my Persian-born doc’s. It’s so adorable that he has his daughter’s feminist anthropology univ press books in each examining room for patients to read while they wait. Proud feminist papa!	en	[]	[]	[]	2	0	45	[]	[]	https://twitter.com/DrSepinwall/status/1354116232237043712	False		0								[]				
