id	conversation_id	created_at	date	time	timezone	user_id	username	name	place	tweet	language	mentions	urls	photos	replies_count	retweets_count	likes_count	hashtags	cashtags	link	retweet	quote_url	video	thumbnail	near	geo	source	user_rt_id	user_rt	retweet_id	reply_to	retweet_date	translate	trans_src	trans_dest
1404520824858726402	1404520824858726402	2021-06-14 12:27:14 PDT	2021-06-14	12:27:14	-0700	1192564385253928965	feministjournal	Feminist Anthropology Journal		Hey there, #anthrotwitter! The AFA is looking for the next editor(s) of Feminist Anthropology, from 2023 - 2025. Proposals due Dec. 31st, 2021.  See the full job description on our Facebook:  https://t.co/vffl25bffc  @femanth @GCcunyAnthro @SocietyVisAnth @culanth  https://t.co/cuDONznxM0	en	[{'screen_name': 'femanth', 'name': 'association for feminist anthropology', 'id': '422375034'}, {'screen_name': 'gccunyanthro', 'name': 'gc cuny anthropology', 'id': '1157332338'}, {'screen_name': 'societyvisanth', 'name': 'society for visual anthropology', 'id': '1049681147846950918'}, {'screen_name': 'culanth', 'name': 'society for cultural anthropology', 'id': '133040246'}]	['http://www.facebook.com/FeministAnthropology']	['https://pbs.twimg.com/media/E33bTQXXMAI-fQS.jpg']	1	35	35	['anthrotwitter']	[]	https://twitter.com/FeministJournal/status/1404520824858726402	False		1	https://pbs.twimg.com/media/E33bTQXXMAI-fQS.jpg							[]				
1404078005438357505	1404078005438357505	2021-06-13 07:07:37 PDT	2021-06-13	07:07:37	-0700	1121586790597627904	putawaytheglobe	Dr. Katrina Daly Thompson 🏳️‍🌈 ☪️ ✍️📚		120/#260articles  Elizabeth Pérez, “‘You Were Gonna Leave Them Out?’: Locating Black Women in a Transfeminist Anthropology of Religion,” Feminist Anthropology 2, no. 1 (2021): 94–111,  https://t.co/vs1PEUdbKO.	en	[]	['https://doi.org/10.1002/fea2.12033']	[]	0	1	7	['260articles']	[]	https://twitter.com/putawaytheglobe/status/1404078005438357505	False		0								[]				
1403381626361585672	1403381626361585672	2021-06-11 09:00:27 PDT	2021-06-11	09:00:27	-0700	27944780	scott_a_ross	a = another world is possible		A new collection from @AmEthno, Legacies and Genealogies in Feminist Anthropology:  https://t.co/5ASzywqlps	en	[{'screen_name': 'amethno', 'name': 'american ethnologist', 'id': '407160443'}]	['https://americanethnologist.org/features/collections/legacies-and-genealogies-in-feminist-anthropology']	[]	0	5	14	[]	[]	https://twitter.com/scott_a_ross/status/1403381626361585672	False		0								[]				
1403057153670356998	1403057153670356998	2021-06-10 11:31:07 PDT	2021-06-10	11:31:07	-0700	4024364656	ideasonfirephd	Ideas On Fire		Catch @drdanaaindavis, @profsassy, &amp; @ratnagiri77 on the #ImagineOtherwisePodcast to hear how they are challenging #AcademicPublishing norms with @FeministJournal and @femanth.  https://t.co/zKGQVUWLwW #FeministAnthropology  https://t.co/nGKvkEgoaK	en	[{'screen_name': 'drdanaaindavis', 'name': 'dana davis', 'id': '1172747403763638272'}, {'screen_name': 'profsassy', 'name': 'ida’s revenge', 'id': '1635862676'}, {'screen_name': 'ratnagiri77', 'name': 'sameena mulla (she/her)', 'id': '48824213'}, {'screen_name': 'feministjournal', 'name': 'feminist anthropology journal', 'id': '1192564385253928965'}, {'screen_name': 'femanth', 'name': 'association for feminist anthropology', 'id': '422375034'}]	['https://l8r.it/GzWY']	['https://pbs.twimg.com/media/E3io4iMWEAYkIP2.jpg']	0	5	14	['imagineotherwisepodcast', 'academicpublishing', 'feministanthropology']	[]	https://twitter.com/IdeasOnFirePhD/status/1403057153670356998	False		1	https://pbs.twimg.com/media/E3io4iMWEAYkIP2.jpg							[]				
1402952642465210376	1402952642465210376	2021-06-10 04:35:50 PDT	2021-06-10	04:35:50	-0700	771412974829305856	porbotialora	ꯃꯥꯀꯨ		We need to give 90% reservation in subjects like gender studies and feminist anthropology to Muslim women. Interesting developments will occur in their society lol...	en	[]	[]	[]	9	0	203	[]	[]	https://twitter.com/porbotialora/status/1402952642465210376	False		0								[]				
1402616712265179139	1402616712265179139	2021-06-09 06:20:58 PDT	2021-06-09	06:20:58	-0700	946700648	channabach	Cathy Hannabach		I LOVED putting this episode together. Check out the amazing special issue of Feminist Anthropology on Cite Black Women if you haven't already!	en	[]	[]	[]	0	0	0	[]	[]	https://twitter.com/channabach/status/1402616712265179139	False	https://twitter.com/IdeasOnFirePhD/status/1402615268971585539	0								[]				
1402543525103812609	1402543525103812609	2021-06-09 01:30:09 PDT	2021-06-09	01:30:09	-0700	752783162049171456	anthroencyclo	Anthropology Encyclopedia		What does a #feminist genealogy of #anthropology look like? New American Ethnologist @AmEthno edited essay collection: Legacies and Genealogies in Feminist Anthropology Edited by Lynn Bolles and Mary H. Moran  https://t.co/ZtWIU1nDvV  https://t.co/BCD5KK4PpC	en	[{'screen_name': 'amethno', 'name': 'american ethnologist', 'id': '407160443'}]	['http://ow.ly/n63Z50F5nzj']	['https://pbs.twimg.com/media/E3bV53BWEAAeQaX.jpg']	0	6	8	['feminist', 'anthropology']	[]	https://twitter.com/anthroencyclo/status/1402543525103812609	False		1	https://pbs.twimg.com/media/E3bV53BWEAAeQaX.jpg							[]				
1402427343562551300	1402427343562551300	2021-06-08 17:48:29 PDT	2021-06-08	17:48:29	-0700	48824213	ratnagiri77	Sameena Mulla (she/her)		Follow the Feminist Anthropology Twitter account and at 3000 followers, we’ll give away a copy of Marrying for a a Future to one of our new followers!	en	[]	[]	[]	0	1	6	[]	[]	https://twitter.com/ratnagiri77/status/1402427343562551300	False	https://twitter.com/FeministJournal/status/1399712340296282114	0								[]				
1402338951957041161	1402336661707628548	2021-06-08 11:57:15 PDT	2021-06-08	11:57:15	-0700	866999983	prisblossom	Pris Blossom🌙✨		@SerenaFreewomyn Fair enough! I just got a lot of encouragement about my work and my writing and they seemed excited to have someone else potentially join in on feminist anthropology (as anthro, like so many other fields, is still male dominated). They would've been rad colleagues.	en	[]	[]	[]	1	0	2	[]	[]	https://twitter.com/PrisBlossom/status/1402338951957041161	False		0								[{'screen_name': 'SerenaFreewomyn', 'name': 'Serena Freewomyn (she/her/they)🏳️\u200d🌈🏳️\u200d⚧️', 'id': '1598877427'}]				
1401902070085586949	1401902070085586949	2021-06-07 07:01:14 PDT	2021-06-07	07:01:14	-0700	1247706454787649536	wcaaimpact	World Council of Anthropological Associations		A Tale of Two Women: Genealogies of Black Feminist Anthropology in Brazil | American Ethnological Society  https://t.co/WtMPdtBAKq  https://t.co/SER2p9PaXG	en	[]	['http://ow.ly/kPeL30rJYcn']	['https://pbs.twimg.com/media/E3SOgKJX0AMo7fk.png']	0	0	7	[]	[]	https://twitter.com/WCAAimpact/status/1401902070085586949	False		1	https://pbs.twimg.com/media/E3SOgKJX0AMo7fk.png							[]				
1401560774544400387	1401560774544400387	2021-06-06 08:25:03 PDT	2021-06-06	08:25:03	-0700	1346999967903203329	iuaescongress	IUAES Congress - Yucatan, Mexico		CALL for PAPERS/ IUAES Congress Yucatán 2021  Genealogies of Feminist Anthropology in Central America and the Caribbean  Conveners: Marisa G. Ruiz Trejo Ana María Gertrudis Mata Parducci Lina Rosa Berrio Palomo  Information  https://t.co/VBiEcVpnIW  https://t.co/WKQmT9Q4Xc	ca	[]	['https://bit.ly/cfpIUAESeng']	['https://pbs.twimg.com/media/E3NYGJHWYAMxTo7.jpg']	0	2	0	[]	[]	https://twitter.com/IuaeScongress/status/1401560774544400387	False		1	https://pbs.twimg.com/media/E3NYGJHWYAMxTo7.jpg							[]				
1401536866399264770	1401536866399264770	2021-06-06 06:50:02 PDT	2021-06-06	06:50:02	-0700	1247706454787649536	wcaaimpact	World Council of Anthropological Associations		Legacies and Genealogies in Feminist Anthropology | American Ethnological Society  https://t.co/wG342npn29  https://t.co/bxNfyPzbOh	ca	[]	['http://ow.ly/eM1630rJY81']	['https://pbs.twimg.com/media/E3NCWnoXwAg7FZf.jpg']	0	3	11	[]	[]	https://twitter.com/WCAAimpact/status/1401536866399264770	False		1	https://pbs.twimg.com/media/E3NCWnoXwAg7FZf.jpg							[]				
1400834551304183810	1400833548764925964	2021-06-04 08:19:17 PDT	2021-06-04	08:19:17	-0700	222193237	fordhamtheology	Fordham Theology		"#FordhamTheology Professor Cristina Traina, Avery Cardinal Dulles, SJ, Chair of Catholic Theology will delivery the plenary this afternoon ""The Power of Anger in the Work of Love, Revisited: Feminist Anthropology and Emotion"" #CTS2021online"	en	[]	[]	[]	0	0	4	['fordhamtheology', 'cts2021online']	[]	https://twitter.com/FordhamTheology/status/1400834551304183810	False		0								[]				
1399796720150749190	1399796720150749190	2021-06-01 11:35:19 PDT	2021-06-01	11:35:19	-0700	407160443	amethno	American Ethnologist		"Anthromoms and Ripples in the Pond: Thank You, Sylvia Helen Forman | Barbara Rose Johnston writing in the new AES collection ""Legacies and Genealogies in Feminist Anthropology.""  https://t.co/Fve8dz5qNq"	en	[]	['https://americanethnologist.org/features/collections/legacies-and-genealogies-in-feminist-anthropology/anthromoms-and-ripples-in-the-pond-thank-you-sylvia-helen-forman']	[]	0	2	7	[]	[]	https://twitter.com/AmEthno/status/1399796720150749190	False		0								[]				
1399779997007683586	1399768587032678412	2021-06-01 10:28:52 PDT	2021-06-01	10:28:52	-0700	2909691652	manigarm	Dr. Holly Walters		@Rebecca_M_Dean This was literally the subject of my article in Feminist Anthropology.  Just....ugh. I am so sorry.	en	[]	[]	[]	1	0	2	[]	[]	https://twitter.com/Manigarm/status/1399779997007683586	False		0								[{'screen_name': 'Rebecca_M_Dean', 'name': 'Drª Prª Srª Rebecca Dean', 'id': '586648614'}]				
1399731524103200775	1399731524103200775	2021-06-01 07:16:15 PDT	2021-06-01	07:16:15	-0700	407160443	amethno	American Ethnologist		"Eleanor Burke Leacock and Historical Transformations of Gender: Beyond Timeless Patriarchy |  Christine Ward Gailey's tribute in the new AES essay collection ""Legacies and Genealogies of Feminist Anthropology."" https://t.co/zNxaIqHazR"	en	[]	['https://americanethnologist.org/features/collections/legacies-and-genealogies-in-feminist-anthropology/eleanor-burke-leacock-and-historical-transformations-of-gender-beyond-timeless-patriarchy']	[]	0	1	5	[]	[]	https://twitter.com/AmEthno/status/1399731524103200775	False		0								[]				
1397952570514198529	1397952570514198529	2021-05-27 09:27:20 PDT	2021-05-27	09:27:20	-0700	407160443	amethno	American Ethnologist		"AES is honored to publish ""Legacies and Genealogies in Feminist Anthropology,"" edited by Lynn Bolles and Mary Moran, themselves long-time friends and collaborators:  https://t.co/k8JGfzATBQ"	en	[]	['https://americanethnologist.org/features/collections/legacies-and-genealogies-in-feminist-anthropology']	[]	0	1	15	[]	[]	https://twitter.com/AmEthno/status/1397952570514198529	False		0								[]				
1397563941589499910	1397563941589499910	2021-05-26 07:43:03 PDT	2021-05-26	07:43:03	-0700	4025196017	reysoofe	Fenneke Reysoo		Fenneke Reysoo gives the award winning speech LOVA Marjan Rens Master’s Thesis Award in Feminist Anthropology, May 28th, 16:30-17:00 on zoom.  https://t.co/QrebIf7Jb6 #lovanetwork #gc-iheid #gendercuso	en	[]	['http://fb.me/e/LI7WuNnf']	[]	0	1	0	['lovanetwork', 'gc', 'gendercuso']	[]	https://twitter.com/reysoofe/status/1397563941589499910	False		0								[]				
1397559957449490433	1397559957449490433	2021-05-26 07:27:13 PDT	2021-05-26	07:27:13	-0700	713101653851959297	prof__lopez	Dr. Andrea M. López		It was a huge honor to contribute to this volume - Legacies and Genealogies in Feminist Anthropology - and contribute a piece about Louise, who was so critical in my academic path. Take a look at the full volume here:  https://t.co/WbjNEoDoGn	en	[]	['https://americanethnologist.org/features/collections/legacies-and-genealogies-in-feminist-anthropology']	[]	1	0	7	[]	[]	https://twitter.com/prof__lopez/status/1397559957449490433	False	https://twitter.com/AmEthno/status/1397264766633132042	0								[]				
1397545654356938764	1397545654356938764	2021-05-26 06:30:23 PDT	2021-05-26	06:30:23	-0700	407160443	amethno	American Ethnologist		Reclaiming Experience, Stories, and Intimacy as Feminist Modes of Knowledge: Learning from Rayna Rapp | a tribute by Mary Anglin in the new AES essay collection Legacies and Genealogies of Feminist Anthropology:  https://t.co/YK9QgHq7Fw	en	[]	['https://americanethnologist.org/features/collections/legacies-and-genealogies-in-feminist-anthropology/reclaiming-experience-stories-and-intimacy-as-feminist-modes-of-knowledge-learning-from-rayna-rapp']	[]	0	6	15	[]	[]	https://twitter.com/AmEthno/status/1397545654356938764	False		0								[]				
1397538891750682624	1397538891750682624	2021-05-26 06:03:31 PDT	2021-05-26	06:03:31	-0700	926898123334660101	camee_maddox	Camee Maddox-Wingfield		Sharing an essay I wrote in tribute to Faye Harrison's mentoring for a special collection of essays by AE on legacies and genealogies in feminist anthropology, edited by A Lynn Bolles and Mary Moran. Check it out!  @amethno  https://t.co/6U2T07sNIU	en	[{'screen_name': 'amethno', 'name': 'american ethnologist', 'id': '407160443'}]	['https://americanethnologist.org/features/collections/legacies-and-genealogies-in-feminist-anthropology/black-feminist-intellectual-affinity-and-the-ethics-of-care-a-tribute-to-faye-harrisons']	[]	1	6	21	[]	[]	https://twitter.com/camee_maddox/status/1397538891750682624	False		0								[]				
1397280273188917254	1397280273188917254	2021-05-25 12:55:51 PDT	2021-05-25	12:55:51	-0700	521889265	ericalwilliams7	Dr. Erica L. Williams is on sabbatical		A Tale of Two Women: Genealogies of Black Feminist Anthropology in Brazil @amethno  https://t.co/F02jMGm6gB	en	[{'screen_name': 'amethno', 'name': 'american ethnologist', 'id': '407160443'}]	['https://americanethnologist.org/features/collections/legacies-and-genealogies-in-feminist-anthropology/a-tale-of-two-women-genealogies-of-black-feminist-anthropology-in-brazil']	[]	0	18	60	[]	[]	https://twitter.com/EricaLWilliams7/status/1397280273188917254	False		0								[]				
1396919197742075908	1396919197742075908	2021-05-24 13:01:04 PDT	2021-05-24	13:01:04	-0700	407160443	amethno	American Ethnologist		Legacies and Genealogies in Feminist Anthropology | by M Anglin, A Aparicio, L Bolles, G Butcher, K DeLucia, J Erickson, C Freeman, C Gailey, C Getrich, B Johnston, C Jones, E Lewin, A Lopez, C Maddox-Wingfield, M Moran, D Thomas, A Wali, E Williams (2/2)  https://t.co/k8JGfzATBQ	en	[]	['https://americanethnologist.org/features/collections/legacies-and-genealogies-in-feminist-anthropology']	[]	0	9	30	[]	[]	https://twitter.com/AmEthno/status/1396919197742075908	False		0								[]				
1393197874155040769	1393197874155040769	2021-05-14 06:33:52 PDT	2021-05-14	06:33:52	-0700	1070015427491872768	ienyet	ieni		some summer vibe Vulpera as a commission &lt;3  meanwhile, im somewhere between folklore and feminist anthropology  https://t.co/27AeLDHzEM	en	[]	[]	['https://pbs.twimg.com/media/E1Wh0FWWQAIsCuA.jpg']	1	0	6	[]	[]	https://twitter.com/ienyet/status/1393197874155040769	False		1	https://pbs.twimg.com/media/E1Wh0FWWQAIsCuA.jpg							[]				
1392880959033380873	1392880959033380873	2021-05-13 09:34:33 PDT	2021-05-13	09:34:33	-0700	350600405	mhymiriam	Miriam Hird-Younger		Thank you to the @CascaWN_RF for the recognition of my #casca2021 paper on the politics of gender audits in the time of #AidToo with the Graduate Student Prize in Feminist Anthropology. Just the motivation I needed in the last month of writing my dissertation!   #cdnanthro	en	[{'screen_name': 'cascawn_rf', 'name': 'cascawn/rf', 'id': '3818186187'}]	[]	[]	1	0	3	['casca2021', 'aidtoo', 'cdnanthro']	[]	https://twitter.com/mhymiriam/status/1392880959033380873	False		0								[]				
1392501756127449089	1392484109226815495	2021-05-12 08:27:44 PDT	2021-05-12	08:27:44	-0700	187257177	clundoff	Catherine Lundoff		@booksnyarn @YarnGeek @ce_murphy Got my undergrad in History/Anthropology and my M.A. in Feminist Anthropology and now I work in IT, write and run a small press. Did a lot of other stuff along the way so don’t feel locked in!	en	[]	[]	[]	0	0	2	[]	[]	https://twitter.com/clundoff/status/1392501756127449089	False		0								[{'screen_name': 'booksnyarn', 'name': '📚 ☕️ 🏳️\u200d🌈 Kristi C.', 'id': '40269827'}, {'screen_name': 'YarnGeek', 'name': 'YarnGeek', 'id': '15073769'}, {'screen_name': 'ce_murphy', 'name': 'CE (Catie) Murphy', 'id': '49057486'}]				
1392077997612568578	1392077997612568578	2021-05-11 04:23:52 PDT	2021-05-11	04:23:52	-0700	1261969439211151360	maomaoshifu	vahlia!!		bleurgh there’s like 3 renditions of this and i don’t like any of them LMAO but hello here is my final project for my feminist anthropology class!! it’s supposed to express disability and the lack of accessibility  https://t.co/qXLoGRlXH5	en	[]	[]	['https://pbs.twimg.com/media/E1Gnju1UcAAYCOR.jpg']	3	1	10	[]	[]	https://twitter.com/maomaoshifu/status/1392077997612568578	False		1	https://pbs.twimg.com/media/E1Gnju1UcAAYCOR.jpg							[]				
1391752155514736640	1391479328668532747	2021-05-10 06:49:06 PDT	2021-05-10	06:49:06	-0700	537812209	the_spiderwife	spiderwife		@MsGamgee89 tbh I think Foucault is a lot easier but that might just be me.   We read Foucault but skipped Butler in my feminist anthropology class and the discussion on Foucault was so surface-level it made me very sad.	en	[]	[]	[]	0	0	0	[]	[]	https://twitter.com/the_spiderwife/status/1391752155514736640	False		0								[{'screen_name': 'MsGamgee89', 'name': 'Justine', 'id': '112926038'}]				
1390008391259598851	1390008391259598851	2021-05-05 11:20:00 PDT	2021-05-05	11:20:00	-0700	1169285317326757888	emerson_orcs	Emerson College Research & Creative Scholarship		"#EC_FacultySpotlight: Nelli Sargsyan, Associate Professor of anthropology in #Marlboro_Institute has an article ""Finding a livable feminist academic life through Rasanblaj"" published in Feminist Anthropology (@FeministJournal), a @WileyHumanities journal.  https://t.co/RA9su1YjS2  https://t.co/pLhjY4ALCt"	en	[{'screen_name': 'feministjournal', 'name': 'feminist anthropology journal', 'id': '1192564385253928965'}, {'screen_name': 'wileyhumanities', 'name': 'wiley humanities', 'id': '22035112'}]	['http://bit.ly/3ti0gvZ']	['https://pbs.twimg.com/media/E0ktBVJWQAIgQFx.png']	0	2	9	['ec_facultyspotlight', 'marlboro_institute']	[]	https://twitter.com/Emerson_ORCS/status/1390008391259598851	False		1	https://pbs.twimg.com/media/E0ktBVJWQAIgQFx.png							[]				
1389214069492699140	1389214060676358146	2021-05-03 06:43:39 PDT	2021-05-03	06:43:39	-0700	3817446261	upennanth	UPenn Anthropology		Lans, A. M. (2020). Decolonize this collection: Integrating black feminism and art to re‐examine human skeletal remains in museums. Feminist Anthropology. DOI: 10.1002/fea2.12027	en	[]	[]	[]	1	0	0	[]	[]	https://twitter.com/UPennAnth/status/1389214069492699140	False		0								[]				
1387796254948614145	1387796253308690432	2021-04-29 08:49:45 PDT	2021-04-29	08:49:45	-0700	2613485677	rjepiobwarrior	Karen A Scott MD MPH FACOG		So much gratitude, appreciation, admiration, and LOVE for @drdanaaindavis who facilitated my discovery &amp; unapologetic embrace of my intellectual genealogy &amp; legacy: Black Feminist Anthropology. My first inspiration: Women of Belize by @mcclaurintweets Spring 98 my senior year.	en	[{'screen_name': 'drdanaaindavis', 'name': 'dana davis', 'id': '1172747403763638272'}, {'screen_name': 'mcclaurintweets', 'name': 'dr. irma mcclaurin, speaking only for myself', 'id': '172143017'}]	[]	[]	1	1	8	[]	[]	https://twitter.com/RJEpiOBWarrior/status/1387796254948614145	False		0								[]				
1387498868799983620	1387498868799983620	2021-04-28 13:08:03 PDT	2021-04-28	13:08:03	-0700	82240152	ellisoncenteruw	EllisonCenterUW		Panel | Feminist Anthropology of Old Europe: Celebrating the Centennial of Marija Gimbutas. April 30 at 9:00 am Pacific Time. A featured event in the @aseeestudies REECAS Northwest Conference. Learn more and register:  https://t.co/3Art584aT3  https://t.co/yy0Z7914gs	en	[{'screen_name': 'aseeestudies', 'name': 'aseees', 'id': '247416384'}]	['https://bit.ly/3xyBfA4']	['https://pbs.twimg.com/media/E0Fi0ZUUYAEFKyj.png']	0	0	0	[]	[]	https://twitter.com/EllisonCenterUW/status/1387498868799983620	False		1	https://pbs.twimg.com/media/E0Fi0ZUUYAEFKyj.png							[]				
1387389428096802819	1387389064534495234	2021-04-28 05:53:10 PDT	2021-04-28	05:53:10	-0700	38076725	kdgriffit	kade doyle griffiths		Much like my social media content, it’s a mix of Marxist feminist anthropology, current events, Queer shit, cursing and sometimes banter with guest stars you may recognize from the comments here.	en	[]	[]	[]	1	0	0	[]	[]	https://twitter.com/kdgriffit/status/1387389428096802819	False		0								[]				
1386442261496406019	1386442261496406019	2021-04-25 15:09:28 PDT	2021-04-25	15:09:28	-0700	1213314522527584257	ameenalpayne	Ameena L. Payne (she/her)		Cite Black Women: A Critical Praxis (A Statement) Feminist Anthropology - Wiley Online Library  https://t.co/GeLDFCjkC5   #CiteBlackWomen	en	[]	['https://anthrosource-onlinelibrary-wiley-com.ezproxy-b.deakin.edu.au/doi/full/10.1002/fea2.12040#.YIXoMqNaQ_E.twitter']	[]	0	0	1	['citeblackwomen']	[]	https://twitter.com/ameenalpayne/status/1386442261496406019	False		0								[]				
1384304851547418625	1384304851547418625	2021-04-19 17:36:10 PDT	2021-04-19	17:36:10	-0700	1316470796798361602	milenkacuevas	Milenka Cuevas Guaman		The Rise of Black Feminist Intellectual Thought and Political Activism in Perinatal Quality Improvement: A Righteous Rage about Racism, Resistance, Resilience, and Rigor - Scott - - Feminist Anthropology - Wiley Online Library  https://t.co/XQrpV2xvPU	en	[]	['https://anthrosource.onlinelibrary.wiley.com/doi/10.1002/fea2.12045']	[]	0	0	0	[]	[]	https://twitter.com/MilenkaCuevas/status/1384304851547418625	False		0								[]				
1383230133939576833	1383230133050306562	2021-04-16 18:25:37 PDT	2021-04-16	18:25:37	-0700	18410403	carol_leigh	carol_leigh		"""...Inspired by Leite’s recovery of whore/puta as a self-identifier for sex workers, and rooted in feminist anthropology and historiography...  https://t.co/OUJ7t5jqkp"	en	[]	['https://tinyurl.com/3k36nezk']	[]	1	0	1	[]	[]	https://twitter.com/carol_leigh/status/1383230133939576833	False		0								[]				
1383185368317456386	1383185368317456386	2021-04-16 15:27:44 PDT	2021-04-16	15:27:44	-0700	172143017	mcclaurintweets	Dr. Irma McClaurin, speaking only for myself		Thanks. @AfrolatinProjec for shout out. My book Black Feminist Anthropology: Theory, Politics, Praxis &amp; Poetics was the FIRST BOOK EVER to lift up Black American Women Anthropologists &amp; put these 3 words together-black/feminist/anthropology. Also Edited @TransformAnthro for 7 yrs  https://t.co/zA2hGXSkQW	en	[{'screen_name': 'afrolatinprojec', 'name': 'afrolatin@project', 'id': '398933718'}, {'screen_name': 'transformanthro', 'name': 'transforming anthro', 'id': '3355180287'}]	[]	['https://pbs.twimg.com/media/EzIPwfHVkAIoDZ4.jpg']	0	1	5	[]	[]	https://twitter.com/mcclaurintweets/status/1383185368317456386	False	https://twitter.com/AfrolatinProjec/status/1383161762690764808	1	https://pbs.twimg.com/media/EzIPwfHVkAIoDZ4.jpg							[]				
1383161762690764808	1383045474589011977	2021-04-16 13:53:56 PDT	2021-04-16	13:53:56	-0700	398933718	afrolatinprojec	Afrolatin@Project		"@EricaLWilliams7 @ABA_AAA @tracie_canada @histanthro Hi re Dr. McClaurin (Black Feminist Anthropology, Black Women of Belize) saw her image but is she part of this?  She also continues doing very important work incl the ""Black Feminist Archive"" at UMass Amherst:  https://t.co/YBQaIMlu2c"	en	[]	['https://www.umass.edu/newsoffice/article/irma-mcclaurin-wins-grant-development']	[]	1	0	2	[]	[]	https://twitter.com/AfrolatinProjec/status/1383161762690764808	False		0								[{'screen_name': 'EricaLWilliams7', 'name': 'Dr. Erica L. Williams is on sabbatical', 'id': '521889265'}, {'screen_name': 'ABA_AAA', 'name': 'Assoc4BlackAnthro', 'id': '216453098'}, {'screen_name': 'tracie_canada', 'name': 'Tracie Canada', 'id': '1344331699241574408'}, {'screen_name': 'histanthro', 'name': 'History of Anthropology Review', 'id': '4184189956'}]				
1382770958495207426	1382770958495207426	2021-04-15 12:01:01 PDT	2021-04-15	12:01:01	-0700	4205331538	saranicolaruth	Sara 🍃💚🍃 #GreenNewDeal ☮️		#FeministAnthropology #CoWriting #Anthropology  https://t.co/jzpxplPyah	und	[]	['https://lnkd.in/eNRPVrg']	[]	1	0	0	['feministanthropology', 'cowriting', 'anthropology']	[]	https://twitter.com/SaraNicolaRuth/status/1382770958495207426	False		0								[]				
1380412656637599744	1380412656637599744	2021-04-08 23:49:58 PDT	2021-04-08	23:49:58	-0700	724844159920648193	helloannahorn	Anna Horn 🤎 She/Her		Take up space, Sis. #PhDLife #BlackScholar #BlackFemimism #Antiracism #Anticolonialism #Anthropology #FeministAnthropology  https://t.co/OPX8RyJ31n	en	[]	[]	['https://pbs.twimg.com/media/Eyg1_jiXMAAgfx4.jpg']	0	1	6	['phdlife', 'blackscholar', 'blackfemimism', 'antiracism', 'anticolonialism', 'anthropology', 'feministanthropology']	[]	https://twitter.com/helloannahorn/status/1380412656637599744	False		1	https://pbs.twimg.com/media/Eyg1_jiXMAAgfx4.jpg							[]				
1379855772927066119	1379855772927066119	2021-04-07 10:57:07 PDT	2021-04-07	10:57:07	-0700	18376460	anthronow	AnthroNow		"“We are not named”: Black Women and the Politics of Citation in Anthropology,"" by Christen Smith, Erica Williams, Imani Wadud, Whitney Pirtle, and The Cite Black Women Collective, and tributes to Leith Mullings are all in the latest Feminist Anthropology  https://t.co/PlCc93Wxyj  https://t.co/uJitvwmHng"	en	[]	['https://bit.ly/2PGCHiw']	['https://pbs.twimg.com/media/EyY6_SgXIAMQtB2.png']	0	0	2	[]	[]	https://twitter.com/AnthroNow/status/1379855772927066119	False		1	https://pbs.twimg.com/media/EyY6_SgXIAMQtB2.png							[]				
