id	conversation_id	created_at	date	time	timezone	user_id	username	name	place	tweet	language	mentions	urls	photos	replies_count	retweets_count	likes_count	hashtags	cashtags	link	retweet	quote_url	video	thumbnail	near	geo	source	user_rt_id	user_rt	retweet_id	reply_to	retweet_date	translate	trans_src	trans_dest
1452464805747601409	1452446805468368903	2021-10-24 19:39:29 PDT	2021-10-24	19:39:29	-0700	36475106	roguechieftan	jayson m porter		@TheBlackEcoFem @CulturedModesty I’d definitely suggest @MeztliYoalli to start! They have Funambulist and Feminist Anthropology articles that slap in all directions.	en	[{'screen_name': 'meztliyoalli', 'name': 'm. yoalli rodríguez', 'id': '95930967'}]	[]	[]	2	0	2	[]	[]	https://twitter.com/RogueChieftan/status/1452464805747601409	False		0								[{'screen_name': 'TheBlackEcoFem', 'name': 'My Ancestors’ baby hairs', 'id': '2317187868'}, {'screen_name': 'CulturedModesty', 'name': 'Metaphors & Memes (ABD)', 'id': '64000972'}]				
1451976729782800398	1451976729782800398	2021-10-23 11:20:03 PDT	2021-10-23	11:20:03	-0700	33914190	uttad	UT Theatre and Dance		In their recent publication in FEMINIST ANTHROPOLOGY, Ph.D. candidate siri gurudev discusses performance as an embodied research method that creates both a window into the past and a portal to the future. #UTTADstudents   Read more:  https://t.co/mun7Jp3RFO  https://t.co/KQ4BTQ9aYo	en	[]	['https://anthrosource.onlinelibrary.wiley.com/doi/epdf/10.1002/fea2.12061']	['https://pbs.twimg.com/media/FCZ1IyhX0AoPRNy.jpg']	0	2	3	['uttadstudents']	[]	https://twitter.com/uttad/status/1451976729782800398	False		1	https://pbs.twimg.com/media/FCZ1IyhX0AoPRNy.jpg							[]				
1451450184152485892	1451450168453124098	2021-10-22 00:27:45 PDT	2021-10-22	00:27:45	-0700	544776631	debramcdougall	Dr Debra McDougall		But, plenaries aren't all of the program... we have p-panels and roundtables on a huge variety of themes! Feminist anthropology @shiorishakuto @CarlySchuster @benj_hegarty, Epistemic attunements @AlisLisaS @Viktor_Baskin   https://t.co/ieXMwEoPjZ	en	[{'screen_name': 'shiorishakuto', 'name': 'shiori shakuto', 'id': '1278522019961663488'}, {'screen_name': 'carlyschuster', 'name': 'caroline schuster', 'id': '326802223'}, {'screen_name': 'benj_hegarty', 'name': 'benjamin hegarty', 'id': '1657425440'}, {'screen_name': 'alislisas', 'name': 'lisa stefanoff', 'id': '171738667'}, {'screen_name': 'viktor_baskin', 'name': 'viktor baskin', 'id': '337682868'}]	['https://www.aasconf.org/2021/programme#10958']	[]	1	1	6	[]	[]	https://twitter.com/DebraMcDougall/status/1451450184152485892	False		0								[]				
1450099883550072833	1450099883550072833	2021-10-18 07:02:08 PDT	2021-10-18	07:02:08	-0700	1192564385253928965	feministjournal	Feminist Anthropology Journal		Feminist Anthropology is officially online!   Visit our brand new website to learn more about us, check out what our authors have to say about us, and be sure to bookmark our site for future CFPs!  Visit us here:  https://t.co/k8RKcVRVre  #anthrotwitter @AmericanAnthro  https://t.co/Y1a7OYZLN8	en	[{'screen_name': 'americananthro', 'name': 'american anthropological association', 'id': '42914038'}]	['https://www.feministanthropology.org/']	['https://pbs.twimg.com/media/FB_J65dWUAErtC8.jpg']	0	59	214	['anthrotwitter']	[]	https://twitter.com/FeministJournal/status/1450099883550072833	False		1	https://pbs.twimg.com/media/FB_J65dWUAErtC8.jpg							[]				
1449146110333886467	1449146103576866822	2021-10-15 15:52:11 PDT	2021-10-15	15:52:11	-0700	14378132	cgbrooke	Cᴏʟʟɪɴ G Bʀᴏᴏᴋᴇ		There's also some work in the May '21 issue of Feminist Anthropology that I need to look at. If you have any other suggestions or resources, please let me know...	en	[]	[]	[]	0	0	0	[]	[]	https://twitter.com/cgbrooke/status/1449146110333886467	False		0								[]				
1449014785920602115	1449014785920602115	2021-10-15 07:10:21 PDT	2021-10-15	07:10:21	-0700	36475106	roguechieftan	jayson m porter		Calling all the reading lists!! You need an update, bc ⁦@MeztliYoalli⁩ dropped this new 🔥🔥  Read, cite, share!!  Grieving geographies, mourning waters: Life, death, and environmental gendered racialized struggles in Mexico - Feminist Anthropology  https://t.co/vKaZ6NoXRt	en	[{'screen_name': 'meztliyoalli', 'name': 'm. yoalli rodríguez', 'id': '95930967'}]	['https://anthrosource.onlinelibrary.wiley.com/doi/abs/10.1002/fea2.12060']	[]	2	7	17	[]	[]	https://twitter.com/RogueChieftan/status/1449014785920602115	False		0								[]				
1449002382470299682	1449002382470299682	2021-10-15 06:21:03 PDT	2021-10-15	06:21:03	-0700	95930967	meztliyoalli	M. Yoalli Rodríguez		"I am so excited to share that my article finally is out in Feminist Anthropology journal ""Grieving geographies, Mourning waters: Life, death, and environmental gendered racialized struggles in Mexico""  https://t.co/WzgCtUrup7"	en	[]	['https://anthrosource.onlinelibrary.wiley.com/doi/epdf/10.1002/fea2.12060']	[]	14	80	339	[]	[]	https://twitter.com/MeztliYoalli/status/1449002382470299682	False		0								[]				
1449001331268538369	1449001331268538369	2021-10-15 06:16:53 PDT	2021-10-15	06:16:53	-0700	1256413891657183233	snehaannavarapu	Sneha Annavarapu		“Living with discomfort feeds into writing with discomfort and into writing discomfort.”   Absolutely brilliant. #mustread   “When discomfort enters our skin: Five feminists in conversation - Feminist Anthropology (⁦@FeministJournal⁩)   https://t.co/jws9J9Lzkt	en	[{'screen_name': 'feministjournal', 'name': 'feminist anthropology journal', 'id': '1192564385253928965'}]	['https://anthrosource.onlinelibrary.wiley.com/doi/full/10.1002/fea2.12059']	[]	1	3	13	['mustread']	[]	https://twitter.com/SnehaAnnavarapu/status/1449001331268538369	False		0								[]				
1447920268127744000	1447920268127744000	2021-10-12 06:41:07 PDT	2021-10-12	06:41:07	-0700	1024482306218762240	randomfandombot	Congrats, you are now a fan of:		Feminist anthropology	en	[]	[]	[]	0	0	0	[]	[]	https://twitter.com/RandomFandomBot/status/1447920268127744000	False		0								[]				
1443256905074413575	1443256902377476105	2021-09-29 09:50:35 PDT	2021-09-29	09:50:35	-0700	233723769	sarahappelhans	Dr. Sarah		Thanks to my wonderful advisor Elise Andaya for your encouragement and insightful reviews of the early drafts. Thank you also to my research participants, without whom this work would not exist. And thank you to @femanth for supporting young scholars in feminist anthropology.	en	[{'screen_name': 'femanth', 'name': 'association for feminist anthropology', 'id': '422375034'}]	[]	[]	0	0	0	[]	[]	https://twitter.com/sarahappelhans/status/1443256905074413575	False		0								[]				
1439182631103574016	1439182631103574016	2021-09-18 04:00:52 PDT	2021-09-18	04:00:52	-0700	269873463	berghahnanthro	BerghahnAnthropology		"""#FeministAnthropology Anew: Motherhood and HIV/AIDS as Sites of Action"" by Pamela J. Downe  https://t.co/Oe18Xks8Hx #freeaccess #HIVandAging @AppAnthro  https://t.co/6zYHhRzrYJ"	en	[{'screen_name': 'appanthro', 'name': 'applied anthropology network', 'id': '730420410458771456'}]	['http://bit.ly/2m0Hk7V']	['https://pbs.twimg.com/media/E_kA-glWQAATNn_.jpg']	0	0	2	['feministanthropology', 'freeaccess', 'hivandaging']	[]	https://twitter.com/BerghahnAnthro/status/1439182631103574016	False		1	https://pbs.twimg.com/media/E_kA-glWQAATNn_.jpg							[]				
1438855195392364544	1438855195392364544	2021-09-17 06:19:45 PDT	2021-09-17	06:19:45	-0700	27914459	aynnekokas	Dr. Aynne Kokas		#PrototypeNation talk @UVA @yunnia: prototyping of the nation and making in China excludes certain people and sites - a key insight on Chinese innovation via feminist anthropology. @PrincetonUP @NCUSCR #PIPFellow	en	[{'screen_name': 'uva', 'name': 'uva', 'id': '1910771'}, {'screen_name': 'yunnia', 'name': 'silvia m. lindtner 林云雅', 'id': '78092953'}, {'screen_name': 'ncuscr', 'name': 'national committee on u.s.-china relations', 'id': '70707861'}]	[]	[]	0	0	0	['prototypenation', 'pipfellow']	[]	https://twitter.com/AynneKokas/status/1438855195392364544	False		0								[]				
1438030571507261441	1438030571507261441	2021-09-14 23:43:00 PDT	2021-09-14	23:43:00	-0700	1406679647803392000	cee_feminisms	CEE feminist research network		How Feminist is the Belarusian Revolution? Female Agency and Participation in the 2020 Post-Election Protests by Natallia Paulovich Open access:  https://t.co/do3NnOlxNY #FeministTheory #agency #subversion #resistance  #FeministAnthropology #FeministPolitics #protest  https://t.co/g9YPyzenQe	en	[]	['http://bit.ly/3tDqRp6']	['https://pbs.twimg.com/media/E_SJn98XMAIwtwm.jpg']	0	1	6	['feministtheory', 'agency', 'subversion', 'resistance', 'feministanthropology', 'feministpolitics', 'protest']	[]	https://twitter.com/CEE_Feminisms/status/1438030571507261441	False		1	https://pbs.twimg.com/media/E_SJn98XMAIwtwm.jpg							[]				
1436743624432275462	1436743624432275462	2021-09-11 10:29:08 PDT	2021-09-11	10:29:08	-0700	133153261	eusosci	Eurosocialsciences		out now: Association for Feminist Anthropology's latest column on Anthropology News. Further details:   https://t.co/cpl2i0dIrp	en	[]	['https://www.anthropology-news.org/articles/feminist-lawyers-fighting-for-gender-equality-in-turkey-from-within-and-against-the-law']	[]	0	0	0	[]	[]	https://twitter.com/eusosci/status/1436743624432275462	False		0								[]				
1436667280960757760	1436667280960757760	2021-09-11 05:25:46 PDT	2021-09-11	05:25:46	-0700	172143017	mcclaurintweets	Dr. Irma McClaurin, speaking only for myself		Thanks @blkwomenradical &amp; @AudreTaughtMe2 for shout out on Black Feminist Anthropology, named an #OutstandingAcademjcTitle by @choicemag. Hard to believe it’s 21 yrs old now. Thks @RutgersUPress for believing in me! Thanks 2 all readers! @ABA_AAA @BlackFeminisms @AmericanAnthro  https://t.co/EAr6fkncgB	en	[{'screen_name': 'blkwomenradical', 'name': 'black women radicals', 'id': '1036779185660993536'}, {'screen_name': 'audretaughtme2', 'name': 'chelsey r. carter 🌻', 'id': '1032280435647242241'}, {'screen_name': 'choicemag', 'name': 'choice magazine', 'id': '3440009848'}, {'screen_name': 'rutgersupress', 'name': 'rutgers university press', 'id': '621047794'}, {'screen_name': 'aba_aaa', 'name': 'assoc4blackanthro', 'id': '216453098'}, {'screen_name': 'blackfeminisms', 'name': 'black feminisms', 'id': '710307769166012416'}, {'screen_name': 'americananthro', 'name': 'american anthropological association', 'id': '42914038'}]	[]	['https://pbs.twimg.com/media/E_ARRjwX0AAxGiw.jpg']	1	6	28	['outstandingacademjctitle']	[]	https://twitter.com/mcclaurintweets/status/1436667280960757760	False	https://twitter.com/AudreTaughtMe2/status/1435728899615383561	1	https://pbs.twimg.com/media/E_ARRjwX0AAxGiw.jpg							[]				
1436113706501369862	1435960299593424897	2021-09-09 16:46:03 PDT	2021-09-09	16:46:03	-0700	118840830	cjfrieman	AsPr Catherine Frieman		@grayestofghosts @AsFarce There's a great paper in Feminist Anthropology that argues we should consider prosthetics kin - by Wolf-Meyer and pub in.2020 though i don't have the full ref to hand	en	[]	[]	[]	0	0	2	[]	[]	https://twitter.com/CJFrieman/status/1436113706501369862	False		0								[{'screen_name': 'grayestofghosts', 'name': 'Louis Chanina, male hysteric 🏳️\u200d⚧️', 'id': '209406360'}, {'screen_name': 'AsFarce', 'name': 'Liz Crash', 'id': '1157582643526922240'}]				
1435731487706398725	1434973934563184642	2021-09-08 15:27:15 PDT	2021-09-08	15:27:15	-0700	326802223	carlyschuster	Caroline Schuster		@11thThesis Yay! Great topic! ps have a student who just finished a wonderful thesis on anthropology’s uneasy alliance with liberal political theories of anti-populism. He’s got an essay forthcoming in the Journal of Feminist Anthropology, will write an intro email	en	[]	[]	[]	0	0	0	[]	[]	https://twitter.com/CarlySchuster/status/1435731487706398725	False		0								[{'screen_name': '11thThesis', 'name': 'Can Aciksoz', 'id': '1479185148'}]				
1435728899615383561	1435728899615383561	2021-09-08 15:16:58 PDT	2021-09-08	15:16:58	-0700	1032280435647242241	audretaughtme2	Chelsey R. Carter 🌻		Black Feminist Anthropology edited by Dr. @mcclaurintweets	en	[{'screen_name': 'mcclaurintweets', 'name': 'dr. irma mcclaurin, speaking only for myself', 'id': '172143017'}]	[]	[]	0	9	20	[]	[]	https://twitter.com/AudreTaughtMe2/status/1435728899615383561	False	https://twitter.com/blkwomenradical/status/1435667079668117508	0								[]				
1435595808502583300	1435595808502583300	2021-09-08 06:28:07 PDT	2021-09-08	06:28:07	-0700	2871167445	tripsandflips_	Dr Angelika Strohmayer ✊🇪🇺		"feminist anthropology in digital spaces allows us to ""rethinking the practice of reserach itself, and how, rather than being extractive, it may promote conviviality, dolidarity, and collective desire"" @IngridBrudvig  #feministMethodsTheoryAction"	en	[{'screen_name': 'ingridbrudvig', 'name': 'ingrid brudvig', 'id': '2543986388'}]	[]	[]	0	1	2	['feministmethodstheoryaction']	[]	https://twitter.com/tripsandflips_/status/1435595808502583300	False		0								[]				
1434187147255304192	1433793869372706822	2021-09-04 09:10:36 PDT	2021-09-04	09:10:36	-0700	841974242837053440	dhboardergiles	David Boarder Giles		@emkayohkay @petetaylor97 @PennyRed @suzanne_moore @Ashworth101 Hi Em! Does that mean you’ve read a whole bunch of gender studies and feminist anthropology and have a thoughtful, nuanced rebuttal of the arguments they’ve spent their lives making? That’s not a rhetorical question. Genuinely curious.	en	[]	[]	[]	3	0	0	[]	[]	https://twitter.com/DHBoarderGiles/status/1434187147255304192	False		0								[{'screen_name': 'emkayohkay', 'name': 'Em Kay', 'id': '1214599293073575937'}, {'screen_name': 'petetaylor97', 'name': 'Peter Taylor ⚒', 'id': '96122276'}, {'screen_name': 'PennyRed', 'name': 'Laurie Penny', 'id': '19530289'}, {'screen_name': 'suzanne_moore', 'name': 'suzanne moore', 'id': '19654724'}, {'screen_name': 'Ashworth101', 'name': 'Louise Ashworth 🦖 🟩⬜️🟪', 'id': '1099390247534759938'}]				
1430153200166912000	1430153200166912000	2021-08-24 06:01:08 PDT	2021-08-24	06:01:08	-0700	334095783	wileygeoanthro	Wiley Geography & Anthropology		"Within the decolonial turn and the scholarly and political genealogies of Black feminist anthropology, this article explores the challenges and opportunities of feminist ethnography in the era of “the end of AIDS.""  Read here:  https://t.co/Dgovv0uJdX  @AmericanAnthro  https://t.co/UlWUcMOTXP"	en	[{'screen_name': 'americananthro', 'name': 'american anthropological association', 'id': '42914038'}]	['http://ow.ly/SadE50FUeKh']	['https://pbs.twimg.com/media/E9jswdkXEAsQbl6.jpg']	0	0	2	[]	[]	https://twitter.com/WileyGeoAnthro/status/1430153200166912000	False		1	https://pbs.twimg.com/media/E9jswdkXEAsQbl6.jpg							[]				
1427204899499089924	1427204899499089924	2021-08-16 02:45:38 PDT	2021-08-16	02:45:38	-0700	903200817792122882	tiinasuopajarvi	Tiina Suopajärvi		"#Ethnologia Scandinavica 2021 is out! Including my @NordwitNCOE article ""Women's Career Moves in Bio and Health Technology as Wayfaring"" and so many other super interesting articles! #feministanthropology   365 sidor, 2021, Häftad, Engelska, 350 kr  https://t.co/If2tnOkjcP"	en	[{'screen_name': 'nordwitncoe', 'name': 'nordwit ncoe', 'id': '957942803786584064'}]	['https://gustavadolfsakademien.bokorder.se/sv-SE/article/4333/ethnologia-scandinavica-2021']	[]	0	1	11	['ethnologia', 'feministanthropology']	[]	https://twitter.com/TiinaSuopajarvi/status/1427204899499089924	False		0								[]				
1422566503208079816	1422566503208079816	2021-08-03 07:34:19 PDT	2021-08-03	07:34:19	-0700	1192564385253928965	feministjournal	Feminist Anthropology Journal		Feminist Anthropology will be sponsoring the #16Stories campaign again this year! Submissions due October 1st!  The Call For Stories is now available on the website here:  https://t.co/4m9kGw36BO  @nwsa @WSQjournal @GCCenterWomen @GC_CUNY @FeministPress @16DaysCampaign	en	[{'screen_name': 'nwsa', 'name': 'the national women’s studies association (nwsa)', 'id': '28626462'}, {'screen_name': 'wsqjournal', 'name': 'wsq', 'id': '380405946'}, {'screen_name': 'gccenterwomen', 'name': 'center for the study of women and society', 'id': '769763009661198336'}, {'screen_name': 'gc_cuny', 'name': 'the graduate center', 'id': '89479750'}, {'screen_name': 'feministpress', 'name': 'feminist press', 'id': '22058884'}, {'screen_name': '16dayscampaign', 'name': 'global 16 days campaign', 'id': '1514419766'}]	['https://16daysoffeministactivism.wordpress.com/']	[]	0	2	5	['16stories']	[]	https://twitter.com/FeministJournal/status/1422566503208079816	False	https://twitter.com/nwsa/status/1422558573339582464	0								[]				
1422014955008708609	1422014955008708609	2021-08-01 19:02:39 PDT	2021-08-01	19:02:39	-0700	1379475591385210884	iuaes_cgfqp	IUAES Comm. of Global Feminism and Queer Politics		Politics of Citation: Christen A. Smith urges the academia to @citeblackwomen in her introduction to the latest issue of Feminist Anthropology @FeministJournal.  https://t.co/3QDpDzPMSB	en	[{'screen_name': 'citeblackwomen', 'name': 'cite black women.', 'id': '941829517273944064'}, {'screen_name': 'feministjournal', 'name': 'feminist anthropology journal', 'id': '1192564385253928965'}]	['https://anthrosource.onlinelibrary.wiley.com/doi/10.1002/fea2.12050']	[]	0	1	8	[]	[]	https://twitter.com/IUAES_CGFQP/status/1422014955008708609	False		0								[]				
1421922433896943623	1421507880344297473	2021-08-01 12:55:00 PDT	2021-08-01	12:55:00	-0700	25864331	marylgray	Mary L. Gray		@postdiscipline more a move in the direction of queer feminist anthropology (thinking of folks, like @drdanaaindavis among others) -- no shade intended re: sosch (as a long-time fan of symbolic interactionism)	en	[{'screen_name': 'drdanaaindavis', 'name': 'dana davis', 'id': '1172747403763638272'}]	[]	[]	1	0	1	[]	[]	https://twitter.com/marylgray/status/1421922433896943623	False		0								[{'screen_name': 'postdiscipline', 'name': 'Rakesh Bhandari', 'id': '785641421692743680'}]				
1419663795602010113	1418760860055609350	2021-07-26 07:19:59 PDT	2021-07-26	07:19:59	-0700	1379475591385210884	iuaes_cgfqp	IUAES Comm. of Global Feminism and Queer Politics		@aus_anth #AAS2021 gender-focused discussions:: P07 'Theory as reproduction 2': Reflections on the history and the contemporary practices of doing feminist anthropology in Australia	en	[]	[]	[]	0	0	0	['aas2021']	[]	https://twitter.com/IUAES_CGFQP/status/1419663795602010113	False		0								[{'screen_name': 'aus_anth', 'name': 'Australian Anthropological Society', 'id': '877069593369497600'}]				
1417882171495391233	1417882171495391233	2021-07-21 09:20:27 PDT	2021-07-21	09:20:27	-0700	1412074096544845827	beditarini	Tarini Bedi		@julia_kowalski_ terrific article that takes seriously emic meanings of how women make worlds. Feminist Anthropology @FeministJournal and @ratnagiri77 @drdanaaindavis making big impacts on  the field! @ https://anthrosource.onlinelibrary.wiley.com/doi/full/10.1002/fea2.12055	en	[{'screen_name': 'feministjournal', 'name': 'feminist anthropology journal', 'id': '1192564385253928965'}, {'screen_name': 'ratnagiri77', 'name': 'sameena mulla (she/her)', 'id': '48824213'}, {'screen_name': 'drdanaaindavis', 'name': 'dana davis', 'id': '1172747403763638272'}]	[]	[]	1	1	8	[]	[]	https://twitter.com/BediTarini/status/1417882171495391233	False		0								[]				
1415294614211375111	1415294614211375111	2021-07-14 05:58:25 PDT	2021-07-14	05:58:25	-0700	86568010	cnewf	Christopher Newfield		Gribaldo’s book is great courtroom hangout feminist anthropology of domestic violence, and the Italian case illuminates others. @aktange @melissagira @seeshespeak	en	[{'screen_name': 'aktange', 'name': 'dr. andrea kaston tange', 'id': '1075506272'}, {'screen_name': 'melissagira', 'name': 'melissa gira grant', 'id': '76093'}, {'screen_name': 'seeshespeak', 'name': 'sheila liming', 'id': '2970619900'}]	[]	[]	0	0	4	[]	[]	https://twitter.com/cnewf/status/1415294614211375111	False	https://twitter.com/_ISRF/status/1414313474172198913	0								[]				
1409054667502460929	1409054667502460929	2021-06-27 00:43:06 PDT	2021-06-27	00:43:06	-0700	1379475591385210884	iuaes_cgfqp	IUAES Comm. of Global Feminism and Queer Politics		‘Feminist Africa, Volume 2, Issue 1 (2021): Extractivism, Resistance, Alternatives’ by Charmaine Pereira and Dzodzi Tsikata. #globalfeminism #resistance ‘feministanthropology  Access:  https://t.co/C6gqtpsoCd  https://t.co/lxRJIf1mlp	ro	[]	['https://bit.ly/3avwb5l']	['https://pbs.twimg.com/media/E433si7XoAEg3FY.png']	0	0	1	['globalfeminism', 'resistance']	[]	https://twitter.com/IUAES_CGFQP/status/1409054667502460929	False		1	https://pbs.twimg.com/media/E433si7XoAEg3FY.png							[]				
1409054417303838729	1409054417303838729	2021-06-27 00:42:06 PDT	2021-06-27	00:42:06	-0700	1379475591385210884	iuaes_cgfqp	IUAES Comm. of Global Feminism and Queer Politics		Check out ‘Facebook’s ad algorithms are still excluding women from seeing jobs.’ An article by Karen Hao in the MIT Technology Review. #globalfeminism #JobEquality  #feministanthropology Access:  https://t.co/db1TiyZsiT  https://t.co/7iRineIXNf	en	[]	['http://tiny.cc/91hwtz']	['https://pbs.twimg.com/media/E433fNHX0AQHFOt.png']	0	0	0	['globalfeminism', 'jobequality', 'feministanthropology']	[]	https://twitter.com/IUAES_CGFQP/status/1409054417303838729	False		1	https://pbs.twimg.com/media/E433fNHX0AQHFOt.png							[]				
1408896511191121921	1408896511191121921	2021-06-26 14:14:38 PDT	2021-06-26	14:14:38	-0700	1379475591385210884	iuaes_cgfqp	IUAES Comm. of Global Feminism and Queer Politics		Final call for papers for our commission's panels and roundtables for IUAES 2021 Yucatan Congress! Panel 1.3) Genealogies of Feminist Anthropology in Central America and the Carribbean.  https://t.co/pUVa57Dmlr	en	[]	[]	['https://pbs.twimg.com/media/E41nvxnX0A0TOnJ.png']	0	0	2	[]	[]	https://twitter.com/IUAES_CGFQP/status/1408896511191121921	False		1	https://pbs.twimg.com/media/E41nvxnX0A0TOnJ.png							[]				
1408521685259620353	1408521685259620353	2021-06-25 13:25:13 PDT	2021-06-25	13:25:13	-0700	7975132	tucson_cowgirl	Monica Surfaro		Call for editor, check it. #feminist #anthropology	en	[]	[]	[]	0	1	1	['feminist', 'anthropology']	[]	https://twitter.com/Tucson_Cowgirl/status/1408521685259620353	False	https://twitter.com/FeministJournal/status/1404520824858726402	0								[]				
1407052158084829195	1405917262754746374	2021-06-21 12:05:50 PDT	2021-06-21	12:05:50	-0700	1389987776670666753	gorilla_not	NotGorilla		@101WolfStar101 @ace15892001 @GodotIsW8ing4U @ctburks milk cost me double, because someone wants to have a free degree on feminist anthropology, it most definitly is theft	en	[]	[]	[]	3	0	23	[]	[]	https://twitter.com/gorilla_not/status/1407052158084829195	False		0								[{'screen_name': '101WolfStar101', 'name': 'ChronicNugget', 'id': '790375519778897920'}, {'screen_name': 'ace15892001', 'name': 'Sonny', 'id': '3168321788'}, {'screen_name': 'GodotIsW8ing4U', 'name': 'Godot', 'id': '19386342'}, {'screen_name': 'ctburks', 'name': 'Christopher Tyler Burks', 'id': '428691828'}]				
1404860005787082753	1404860005787082753	2021-06-15 10:55:01 PDT	2021-06-15	10:55:01	-0700	1131652747160301568	anthropology4u	Anthropology 4U		"Interested in anthropological theory? Check out ""Black Feminist Anthropology: Theory, Politics, Praxis, &amp; Poetics."" Learn about: formation of Black Feminist Anthropology, identity as a Black Feminist Anthropologist, Black Feminist perspectives, &amp; more! #Anthropology #ANTH4U  https://t.co/gxVnhZAnMb"	en	[]	[]	['https://pbs.twimg.com/media/E38QucbXMAIy51-.jpg']	0	1	5	['anthropology', 'anth4u']	[]	https://twitter.com/Anthropology4U/status/1404860005787082753	False		1	https://pbs.twimg.com/media/E38QucbXMAIy51-.jpg							[]				
1404759343002636290	1404759343002636290	2021-06-15 04:15:01 PDT	2021-06-15	04:15:01	-0700	942257119318786049	inflamedsatiric	Emma 🐝		"I was reading feminist anthropology once &amp; the author was critiquing the dumbass male anthropologists and no shit she once read something like ""the whole tribe left down river for another village today, only the women and children remained"""	en	[]	[]	[]	0	0	0	[]	[]	https://twitter.com/inflamedsatiric/status/1404759343002636290	False		0								[]				
1404736703307436032	1404736703307436032	2021-06-15 02:45:03 PDT	2021-06-15	02:45:03	-0700	1247706454787649536	wcaaimpact	World Council of Anthropological Associations		Call for Editors for Feminist Anthropology!  The Association for Feminist Anthropology (AFA) invites proposals to provide editorial stewardship for Feminist Anthropology, beginning January 1, 2023 for three years (December 31, 2025 end date).  Info:  https://t.co/7hYhEH3MlX  https://t.co/HGPAqHDSR4	en	[]	['http://ow.ly/MFMl50FamoD']	['https://pbs.twimg.com/media/E36glnnXwAUnlRL.jpg']	0	6	6	[]	[]	https://twitter.com/WCAAimpact/status/1404736703307436032	False		1	https://pbs.twimg.com/media/E36glnnXwAUnlRL.jpg							[]				
1404580141850787841	1404580141850787841	2021-06-14 16:22:56 PDT	2021-06-14	16:22:56	-0700	61481502	spinifexpress	Spinifex Press		Congratulations to Professor Diane Bell, who has received an Order of Australia medal for her service to literature. But her other achievements are equally noteworthy, including her service to higher education, feminist anthropology and her work with indigenous peoples.	en	[]	[]	[]	1	1	8	[]	[]	https://twitter.com/spinifexpress/status/1404580141850787841	False	https://twitter.com/spinifexpress/status/1404579890721034245	0								[]				
